4024,"The Search for the Discipline of Nursing (HSC) Medicine - Nursing;  Journal of Nursing Management ---Wiley School of Health and Human Sciences, Professor of Health Care Development, Southern Cross University, Lismore, NSW, Australia",+Euphemisms for Plagiarism+Plagiarism of Text,Iain W Graham,05/23/2010 20609054 10.1111/j.1365-2834.2010.01104.x,09/01/2010 20857609,Research Article Retraction,Australia No
17421,Titanium Plate Removal Following the Use of Semirigid Fixation Technique in Orthognathic Surgery (HSC) Medicine - Orthopedics; (HSC) Medicine - Rehabilitation/Therapy; (HSC) Medicine - Surgery;  Journal of Oral and Maxillofacial Surgery: Official Journal of the American Association of Oral and Maxillofacial Surgeons ---Elsevier Tufts Univeristy School of Dental Medicine,+Notice - Limited or No Information,N Demetriades C Laskarides M Jarmoc L Hu P Stark,08/19/2010 00000000 10.1016/j.joms.2010.06.216,09/01/2010 00000000 10.1016/j.joms.2010.06.216,Conference Abstract/Paper Retraction,United States No
336,"Aberrant expression of the transcription factor Twist in adult T-cell leukemia (BLS) Biology - Cellular; (BLS) Biology - Molecular; (HSC) Medicine - Oncology;  Blood ---American Society of Hematology Division of Molecular Virology and Oncology, Graduate School of Medicine, University of the Ryukyus, Nishihara, Okinawa, Japan http://retractionwatch.com/2012/04/06/back-in-the-saddle-after-30-retractions-naoki-mori-publishing-again/ http://retractionwatch.com/2010/12/24/japanese-virologist-hit-with-publishing-ban-after-widespread-data-manipulation/",+Duplication of Image+Falsification/Fabrication of Image+Investigation by Company/Institution+Investigation by Journal/Publisher+Misconduct - Official Investigation/Finding+Misconduct by Author,Hiroe Tanji Chie Ishikawa Shigeki Sawada Sawako Nakachi Reika Takamatsu Takehiro Matsuda Taeko Okudaira Jun-Nosuke Uchihara Kazuiku Ohshiro Yuetsu Tanaka Masachika Senba Hiroshi Uezato Koichi Ohshima Madeleine Duc Dodon Kou-Juey Wu Naoki Mori,01/13/2010 20071663 10.1182/blood-2009-07-232231,08/26/2010 20574045 10.1182/blood-2010-06-292862,Research Article Retraction,Japan No
15151,"Bed Vibration Measurement and Evaluation for Maintanace Health Systems (B/T) Technology; (HSC) Medicine - General; (PHY) Mathematics;  2010 2nd International Conference on Mechanical and Electronics Engineering ---Institute of Electrical and Electronics Engineers (IEEE) Department of Measurement and Control, VSB - Technical University of Ostrava, Czech Republic http://retractionwatch.com/2015/06/25/one-publisher-appears-to-have-retracted-thousands-of-meeting-abstracts-yes-thousands/",+Notice - Limited or No Information,M Cerny M Penhaker,08/01/2010,08/26/2010  10.1109/ICMEE.2010.5558528,Conference Abstract/Paper Retraction,Czech Republic No
15229,"Design, optimization and experimental evaluation of a novel tactile sensor for large surgical grasper (HSC) Medicine - Surgery; (PHY) Engineering - Mechanical;  2010 2nd International Conference on Mechanical and Electronics Engineering ---Institute of Electrical and Electronics Engineers (IEEE) Mechanical Engineering Department, Sharif University of Technology-Int. Campus, Kish Island, Iran Robotic Surgery Lab., Research Center for Sci. and Tech. in Medicine, Tehran, Iran Mechanical Engineering Department, Sharif University of Technology & Robotic Surgery Lab., RCSTIM, Tehran, Iran http://retractionwatch.com/2015/06/25/one-publisher-appears-to-have-retracted-thousands-of-meeting-abstracts-yes-thousands/",+Notice - Limited or No Information+Withdrawal,Ali Mohammad Shariatmadar Ahmadi Mohammad Javad Shamsollahi Alireza Alireza Mirbagheri Farzam Farahmand,08/01/2010  10.1109/ICMEE.2010.5558477,08/26/2010  10.1109/ICMEE.2010.5558477,Conference Abstract/Paper Retraction,Iran No
13753,"Example analysis of chemical contaminant's transporting model in groundwater aquifer (ENV) Ground/Surface Water; (HSC) Public Health and Safety; (PHY) Engineering - General; (PUB) Society/Association Journals;  2010 Second International Conference on Modeling, Simulation and Visualization Methods ---Institute of Electrical and Electronics Engineers (IEEE) School of Resources and Environment, University of Jinan, Jinan, Shandong, P.R.China School of Water Resources and Environment, China University of Geoscience, Beijing, China http://retractionwatch.com/2015/06/25/one-publisher-appears-to-have-retracted-thousands-of-meeting-abstracts-yes-thousands/",+Breach of Policy by Author+Investigation by Journal/Publisher+Notice - Limited or No Information,Ben-hua Liu Hong-han Chen Ming-zhu Liu,05/15/2010  10.1109/WMSVM.2010.37,08/26/2010  10.1109/WMSVM.2010.37,Conference Abstract/Paper Retraction,China No
335,"Overexpression of caveolin-1 in adult T-cell leukemia (BLS) Biology - Cellular; (BLS) Biology - Molecular; (HSC) Medicine - Oncology;  Blood ---American Society of Hematology Division of Molecular Virology and Oncology, Graduate School of Medicine, University of the Ryukyus, Okinawa 903-0215, Japan http://retractionwatch.com/2012/04/06/back-in-the-saddle-after-30-retractions-naoki-mori-publishing-again/ http://retractionwatch.com/2010/12/24/japanese-virologist-hit-with-publishing-ban-after-widespread-data-manipulation/",+Duplication of Data+Falsification/Fabrication of Image+Investigation by Company/Institution+Investigation by Journal/Publisher+Misconduct - Official Investigation/Finding+Misconduct by Author,Shigeki Sawada Chie Ishikawa Hiroe Tanji Sawako Nakachi Masachika Senba Taeko Okudaira Jun-Nosuke Uchihara Naoya Taira Kazuiku Ohshiro Yasuaki Yamada Yuetsu Tanaka Hiroshi Uezato Koichi Ohshima Ken Sasai Boudewijn M T Burgering Madeleine Duc Dodon Masahiro Fujii Hajime Sunakawa Naoki Mori,03/18/2010 20061557 10.1182/blood-2009-08-240044,08/26/2010 20574044 10.1182/blood-2010-06-292854,Research Article Retraction,Japan No
14848,"Relationship Study of Heart Rate and Systolic Blood Pressure for Healthy Peoples (B/T) Technology; (HSC) Medicine - General; (HSC) Radiology/Imaging; (PHY) Mathematics;  2010 2nd International Conference on Mechanical and Electronics Engineering ---Institute of Electrical and Electronics Engineers (IEEE) Department of Electronics, Faculty of Electrical Engineering, Universiti Teknologi Malaysia, Skudai, Johor, Malaysia Bio-Medical Instrumentation Research Group, Universiti Teknologi Malaysia, Skudai, Johor, Malaysia http://retractionwatch.com/2015/06/25/one-publisher-appears-to-have-retracted-thousands-of-meeting-abstracts-yes-thousands/",+Notice - Limited or No Information,N H Mahmood N A Zakaria S N Jalaludin N B Sharifmuddin,08/01/2010,08/26/2010  10.1109/ICMEE.2010.5558450,Conference Abstract/Paper Retraction,Malaysia No
15157,"Tapered Tip Hollow Silicon Microneedles for Transdermal Drug Delivery (HSC) Medicine - General; (PHY) Materials Science; (PHY) Mathematics;  2010 2nd International Conference on Mechanical and Electronics Engineering ---Institute of Electrical and Electronics Engineers (IEEE) School of Engineering and Technology, Asian Institute of Technology (AIT), Bangkok, Thailand http://retractionwatch.com/2015/06/25/one-publisher-appears-to-have-retracted-thousands-of-meeting-abstracts-yes-thousands/",+Notice - Limited or No Information,Muhammad Waseem Ashaf Shahzadi Tayyaba Nitin Afzulpurkar,08/01/2010,08/26/2010  10.1109/ICMEE.2010.5558506,Conference Abstract/Paper Retraction,Thailand No
15227,"Two layered novel Anodic Aluminum Oxide nanoporous membrane (HSC) Medicine - Rehabilitation/Therapy; (HSC) Medicine - Urology/Nephrology; (PHY) Engineering - General; (PHY) Materials Science; (PHY) Nanotechnology;  2010 2nd International Conference on Mechanical and Electronics Engineering ---Institute of Electrical and Electronics Engineers (IEEE) School of Engineering and Technology, Asian Institute of Technology (AIT), Pathum Thani, 12120, Thailand MEMS Lab, National Electronics and Computer Technology Center, Pathum Thani, 12120, Thailand http://retractionwatch.com/2015/06/25/one-publisher-appears-to-have-retracted-thousands-of-meeting-abstracts-yes-thousands/",+Notice - Limited or No Information,Ajab Khan Kasi Jafar Khan Kasi Muhammad Waseem Ashraf Shahzadi Tayyaba Nitin Afzulpurkar Adisorn Tuantranont,08/01/2010  10.1109/ICMEE.2010.5558499,08/26/2010  10.1109/ICMEE.2010.5558499,Conference Abstract/Paper Retraction,Thailand No
14234,"Assessing Two Emotion Regulation Processes in Chinese Adolescents (HSC) Medicine - Pediatrics; (PHY) Mathematics; (SOC) Psychology;  2010 IEEE International Conference on Advanced Management Science (ICAMS 2010) ---Institute of Electrical and Electronics Engineers (IEEE) Department of Economics and Management, Sanming University, China http://retractionwatch.com/2015/06/25/one-publisher-appears-to-have-retracted-thousands-of-meeting-abstracts-yes-thousands/",+Notice - Limited or No Information+Withdrawal,Zhibin Chen,07/09/2010,08/23/2010  10.1109/ICAMS.2010.5553216,Conference Abstract/Paper Retraction,China No
14668,"Research on dissipative structure characteristics of safety input-output system (HSC) Occupational Health and Safety; (PHY) Mathematics; (PUB) Society/Association Journals;  2010 IEEE International Conference on Advanced Management Science (ICAMS 2010) ---Institute of Electrical and Electronics Engineers (IEEE) Safety Engineering College, Heilongjiang Institute of Science and Technology, Heilongjiang IST, Harbin city, Heilongjiang Province, 150027, China http://retractionwatch.com/2015/06/25/one-publisher-appears-to-have-retracted-thousands-of-meeting-abstracts-yes-thousands/",+Breach of Policy by Author+Investigation by Journal/Publisher+Notice - Limited or No Information,Lihua Zhu Feng Xu,07/09/2010  10.1109/ICAMS.2010.5553125,08/23/2010  10.1109/ICAMS.2010.5553125,Conference Abstract/Paper Retraction,China No
14901,"Research on the dividing standards of responsibility for natural disaster risk based on FIDIC (HSC) Public Health and Safety; (PUB) Society/Association Journals;  2010 IEEE International Conference on Advanced Management Science (ICAMS 2010) ---Institute of Electrical and Electronics Engineers (IEEE) Department of civil engineering, North China Institute of Science and Technology, East Yanjiao, Beijing, China School of economy and management, Hebei University of engineering, Handan, China http://retractionwatch.com/2015/06/25/one-publisher-appears-to-have-retracted-thousands-of-meeting-abstracts-yes-thousands/",+Investigation by Journal/Publisher+Notice - Limited or No Information+Withdrawal,Zhanglin Guo Yuli Sun,07/09/2010 00000000 10.1109/ICAMS.2010.5552907,08/23/2010 00000000 10.1109/ICAMS.2010.5552907,Conference Abstract/Paper Retraction,China No
14563,"Study on Psychological Relation Among Job Satisfaction, Stress Level and Self-efficacy of Safety Personnel in Coal Mine (HSC) Occupational Health and Safety; (PHY) Mathematics; (SOC) Psychology;  2010 IEEE International Conference on Advanced Management Science (ICAMS 2010) ---Institute of Electrical and Electronics Engineers (IEEE) Institute of Mining & Technology, Taiyuan University of Technology, China http://retractionwatch.com/2015/06/25/one-publisher-appears-to-have-retracted-thousands-of-meeting-abstracts-yes-thousands/",+Notice - Limited or No Information+Withdrawal,Ji-zu Li Ya-hui Wang,07/09/2010,08/23/2010  10.1109/ICAMS.2010.5553015,Conference Abstract/Paper Retraction,China No
14180,"The Relationship Between Hospital Ownership, Hospital Process Orientation and Volume Flexibility, an Empirical Study of 172 Hospital Departments in Shanghai (B/T) Computer Science; (B/T) Technology; (HSC) Medicine - General; (PHY) Mathematics;  2010 IEEE International Conference on Advanced Management Science (ICAMS 2010) ---Institute of Electrical and Electronics Engineers (IEEE) Department of Economic and Management, Shanghai JiaoTong University, China Department of Commerce Management, Shanghai Lixin University of Commerce, China http://retractionwatch.com/2015/06/25/one-publisher-appears-to-have-retracted-thousands-of-meeting-abstracts-yes-thousands/",+Notice - Limited or No Information+Withdrawal,Y H Yang Q F Jiang,07/09/2010,08/23/2010  10.1109/ICAMS.2010.5553277,Conference Abstract/Paper Retraction,China No
14881,"Work safety evaluation of construction company based on unascertained measure (B/T) Business - General; (HSC) Occupational Health and Safety; (PUB) Society/Association Journals;  2010 IEEE International Conference on Advanced Management Science (ICAMS 2010) ---Institute of Electrical and Electronics Engineers (IEEE) School of Civil Engineering, Hebei University of Engineering Handan, China http://retractionwatch.com/2015/06/25/one-publisher-appears-to-have-retracted-thousands-of-meeting-abstracts-yes-thousands/",+Investigation by Journal/Publisher+Notice - Limited or No Information+Withdrawal,Aikun Gao Fengping Suo,07/09/2010 00000000 10.1109/ICAMS.2010.5553179,08/23/2010 00000000 10.1109/ICAMS.2010.5553179,Conference Abstract/Paper Retraction,China No
1873,"Influenza or not Influenza: Analysis of a Case of High Fever That Happened 2000 Years Ago in Biblical Time (BLS) Microbiology; (HSC) Medicine - Infectious Disease;  Virology Journal ---BioMed Central (BMC) Department of Paediatrics, The Chinese University of Hong Kong, Prince of Wales Hospital, Shatin, Hong Kong SAR, China http://retractionwatch.com/2010/08/12/the-shroud-of-retraction-virology-journal-withdraws-paper-about-whether-christ-cured-a-woman-with-the-flu/",+Concerns/Issues About Data+Error in Data,Kam L E Hon Pak C Ng Ting F Leung,07/21/2010 20663162 10.1186/1743-422X-7-169,08/13/2010 20707907 10.1186/1743-422X-7-190,Case Report Retraction,China No
17415,"Protein adsorption on low temperature alpha alumina films for surgical instruments (BLS) Biochemistry; (BLS) Biology - Cellular; (HSC) Medicine - Surgery; (HSC) Occupational Health and Safety; (HSC) Public Health and Safety;  Thin Solid Films ---Elsevier University of Arkansas, Fayetteville, AR 72701, USA Ian Wark Research Institute, University of South Australia, Mawson Lakes, Adelaide, SA 5095, Australia",+Duplication of Article+Error by Journal/Publisher,Andrew N Cloud Shashi V Abinesh Kumar Mahendra Kavdia Husam Hamza Abu-Safe Matt H Gordon,09/16/2008 00000000 10.1016/j.tsf.2008.08.002,08/13/2010 00000000 10.1016/j.tsf.2010.06.001,Research Article Retraction,Australia United States No
13342,"A study of safety sequencing for aviation maintenance multi-index (B/T) Transportation; (HSC) Public Health and Safety;  2010 International Conference on Computer and Communication Technologies in Agriculture Engineering ---Institute of Electrical and Electronics Engineers (IEEE) Air Traffic Management College, Civil Aviation University of China, Tianjin, China http://retractionwatch.com/2015/06/25/one-publisher-appears-to-have-retracted-thousands-of-meeting-abstracts-yes-thousands/",+Notice - Limited or No Information+Withdrawal,Zhang Zhaoning Feng Shoule Liu Jimin Dai Xiaoxu,06/12/2010,08/12/2010  10.1109/CCTAE.2010.5544800,Conference Abstract/Paper Retraction,China No
13265,"Application and implementation of cubic equation in velocity smoothing (HSC) Occupational Health and Safety; (PHY) Engineering - Mechanical; (PHY) Physics;  2010 International Conference on Computer and Communication Technologies in Agriculture Engineering ---Institute of Electrical and Electronics Engineers (IEEE) School of Computer and Communication Engineering, Zheng Zhou University of Light Industry, 450002, China School of Light Chemical Engineering, Henan Industry Design School, Zheng Zhou 450002, China http://retractionwatch.com/2015/06/25/one-publisher-appears-to-have-retracted-thousands-of-meeting-abstracts-yes-thousands/",+Notice - Limited or No Information+Withdrawal,Baowei Zhang Jianwei Zhang Chunxue Wei,06/12/2010,08/12/2010  10.1109/CCTAE.2010.5544359,Conference Abstract/Paper Retraction,China No
12890,"Application of the fuzzy comprehensive evaluation model based on entropy to the risk evaluation of urban gas pipeline system (B/T) Urban Planning; (HSC) Public Health and Safety;  2010 International Conference on Computer and Communication Technologies in Agriculture Engineering ---Institute of Electrical and Electronics Engineers (IEEE) Department of civil engineering, North China Institute of Science and Technology, Beijing, China School of Economics and Management, HeBei University of Engineering, Handan, China http://retractionwatch.com/2015/06/25/one-publisher-appears-to-have-retracted-thousands-of-meeting-abstracts-yes-thousands/",+Notice - Limited or No Information+Withdrawal,Zhanglin Guo Lifang Sun Lilei Bo,06/12/2010,08/12/2010  10.1109/CCTAE.2010.5545041,Conference Abstract/Paper Retraction,China No
13039,"Application of unascertained measure comprehensive evaluation model in water quality assessment (B/T) Computer Science; (ENV) Ground/Surface Water; (HSC) Public Health and Safety; (PUB) Society/Association Journals;  2010 International Conference on Computer and Communication Technologies in Agriculture Engineering ---Institute of Electrical and Electronics Engineers (IEEE) Department of civil engineering, North China Institute of Science and Technology, Beijing, China School of Economics and Management, HeBei University of Engineering, Handan, China Ke Xin college, HeBei University of Engineering, Handan, China http://retractionwatch.com/2015/06/25/one-publisher-appears-to-have-retracted-thousands-of-meeting-abstracts-yes-thousands/",+Investigation by Journal/Publisher+Notice - Limited or No Information+Withdrawal,Zhanglin Guo Lifang Sun Tao Wang,06/12/2010  10.1109/CCTAE.2010.5545047,08/12/2010  10.1109/CCTAE.2010.5545047,Conference Abstract/Paper Retraction,China No
4672,"Isolated subacute effusive and nonconstrictive epicarditis masquerading as a right atrial mass (HSC) Medicine - Cardiology; (HSC) Medicine - Rehabilitation/Therapy;  Echocardiography ---Wiley Department of Cardiology, North Shore University Hospital, 300 Community Drive, Manhasset, NY 11030 Department of Pathology, North Shore University Hospital, 300 Community Drive, Manhasset, NY 11030",+Withdrawal,Valentin Suma Amgad N Makaryus Mario Rascon Sanjay Doddamani Dali Fan Lawrence M Boxt,03/10/2009 19490015 10.1111/j.1540-8175.2008.00846.x,08/12/2010 21089224 10.1111/j.1540-8175.2010.01292.x,Case Report Retraction,United States Yes
13006,"Microbial detection technology research progress (B/T) Technology; (HSC) Public Health and Safety; (PUB) Society/Association Journals;  2010 International Conference on Computer and Communication Technologies in Agriculture Engineering ---Institute of Electrical and Electronics Engineers (IEEE) School of Agriculture and Bioengineering, Tianjin University, 300072, China http://retractionwatch.com/2015/06/25/one-publisher-appears-to-have-retracted-thousands-of-meeting-abstracts-yes-thousands/",+Investigation by Journal/Publisher+Notice - Limited or No Information+Withdrawal,Kou Xiaohong Yunpeng Wang Xu Wentao Zuoqi Xue Zhaohui,06/12/2010  10.1109/CCTAE.2010.5545065,08/12/2010  10.1109/CCTAE.2010.5545065,Conference Abstract/Paper Retraction,China No
12772,"Optimization of bionics knee joint mechanism structure (B/T) Technology; (HSC) Medicine - Orthopedics; (PHY) Engineering - Mechanical; (PUB) Society/Association Journals;  2010 International Conference on Computer and Communication Technologies in Agriculture Engineering ---Institute of Electrical and Electronics Engineers (IEEE) School of Mechanical Engineering, Northwestern Polytechnical University, Xi'an, Shannxi, 710072, China http://retractionwatch.com/2015/06/25/one-publisher-appears-to-have-retracted-thousands-of-meeting-abstracts-yes-thousands/",+Investigation by Journal/Publisher+Notice - Limited or No Information+Withdrawal,Li Jing Qin Xiansheng,06/12/2010  10.1109/CCTAE.2010.5544197,08/12/2010  10.1109/CCTAE.2010.5544197,Conference Abstract/Paper Retraction,China No
13567,"Preliminary study of disaster prevention in rural environment system (HSC) Public Health and Safety; (PUB) Society/Association Journals;  2010 International Conference on Computer and Communication Technologies in Agriculture Engineering ---Institute of Electrical and Electronics Engineers (IEEE) School Of Civil Engineering And Architecture, Nanchang University, China http://retractionwatch.com/2015/06/25/one-publisher-appears-to-have-retracted-thousands-of-meeting-abstracts-yes-thousands/",+Investigation by Journal/Publisher+Notice - Limited or No Information+Withdrawal,Li Tao Min Wu Zhi-Qing Zhao,06/12/2010  10.1109/CCTAE.2010.5544959,08/12/2010  10.1109/CCTAE.2010.5544959,Conference Abstract/Paper Retraction,China No
12915,"Relative efficiency evaluation of Chinese health care system based on data envelopment analysis (DEA) model (HSC) Medicine - General;  2010 International Conference on Computer and Communication Technologies in Agriculture Engineering ---Institute of Electrical and Electronics Engineers (IEEE) Zhuhai College. Jinan University, Mathematical Modeling Innovative Practice Base, China http://retractionwatch.com/2015/06/25/one-publisher-appears-to-have-retracted-thousands-of-meeting-abstracts-yes-thousands/",+Notice - Limited or No Information+Withdrawal,Feng Zhou Yuan-Biao Zhang,06/12/2010,08/12/2010  10.1109/CCTAE.2010.5544840,Conference Abstract/Paper Retraction,China No
13038,"Research on development status of disaster prevention and mitigation engineering (HSC) Public Health and Safety; (PUB) Society/Association Journals;  2010 International Conference on Computer and Communication Technologies in Agriculture Engineering ---Institute of Electrical and Electronics Engineers (IEEE) Information school, Beijing Wuzi University, 101149, China School of Economics and Management, Hebei University of engineering, 056038, Handan, China Department of civil engineering, North China Institute of Science and Technology, 101601, Beijing, China http://retractionwatch.com/2015/06/25/one-publisher-appears-to-have-retracted-thousands-of-meeting-abstracts-yes-thousands/",+Investigation by Journal/Publisher+Notice - Limited or No Information+Withdrawal,Jun-e Liu Lixia Peng Zhanglin Guo,06/12/2010  10.1109/CCTAE.2010.5544069,08/12/2010  10.1109/CCTAE.2010.5544069,Conference Abstract/Paper Retraction,China No
13003,"The health cost estimation and empirical study in Shanghai—Basing on Principal Component Analysis (B/T) Business - General; (HSC) Public Health and Safety; (PUB) Society/Association Journals;  2010 International Conference on Computer and Communication Technologies in Agriculture Engineering ---Institute of Electrical and Electronics Engineers (IEEE) School of Management, Shanghai University of Engineering and Science, China http://retractionwatch.com/2015/06/25/one-publisher-appears-to-have-retracted-thousands-of-meeting-abstracts-yes-thousands/",+Investigation by Journal/Publisher+Notice - Limited or No Information+Withdrawal,Youchun Tang Wei Wang Xuehui Wu,06/12/2010  10.1109/CCTAE.2010.5544374,08/12/2010  10.1109/CCTAE.2010.5544374,Conference Abstract/Paper Retraction,China No
2703,"Endotoxin-mediated regulation of nuclear factor-kappaB nuclear translocation and activation in the hippocampus of the central nervous system: modulation by intracerebroventricular treatment with thymulin and the immunomodulatory role of the IkappaB-alpha/pIkappaB-alpha pathway (BLS) Neuroscience; (HSC) Medicine - Neurology;  Neuroscience ---Elsevier Oxygen Signaling Research Group, Maternal and Child Health Sciences, School of Medicine, Ninewells Hospital and Medical School, University of Dundee, Dundee, Scotland, UKDepartment of Human Morphology, Faculty of Medicine, American University of Beirut, Beirut, Lebanon",+Conflict of Interest,John J Haddad,12/29/2009 19782726 10.1016/j.neuroscience.2009.09.056,08/11/2010 20626085 10.1016/j.neuroscience.2010.03.043,Clinical Study Retraction,Lebanon United Kingdom No
847,"A pilot study on perceived stress and PTSD symptomatology in relation to four dimensions of older women's physical health (HSC) Medicine - General; (SOC) Psychology;  Aging and Mental Health ---Taylor and Francis Department of Clinical Psychology, California State University Northridge, Northridge, CA, USA",+Duplication of Article+Error by Journal/Publisher,Luciana Laganà Stacy L. Reger,05/06/2010 20455114 10.1080/13607860903046578,08/03/2010 20686986 10.1080/13607863.2010.502768,Research Article Retraction,United States No
4180,"Effect of obstructive sleep apnea on aortic elastic parameters: relationship to left ventricular mass and function (HSC) Medicine - Cardiology;  Circulation Journal : Official Journal of the Japanese Circulation Society ---The Japanese Circulation Society Departments of Cardiology, Pamukkale University School of MedicineDepartments of Otorhinolaryngology, Pamukkale University School of MedicineDepartments of Radiology, Pamukkale University School of MedicineDepartments of Chest Disease, Pamukkale University School of Medicine",+Breach of Policy by Author+Duplication of Article,Halil Tanriverdi Harun Evrengul Asuman Kaftan Cuneyt-Orhan Kara Omur Kuru Seyhan Tanriverdi Sibel Ozkurt Ender Semiz,05/25/2006 16723796 10.1253/circj.70.737,08/03/2010 20689222 10.1253/circj.CJ-74-0902,Clinical Study Retraction,Turkey No
17886,"A study of accident and emergency department attendances by infants under 1 in London: An epidemiological study (HSC) Biostatistics/Epidemiology; (HSC) Medicine - Pediatrics; (HSC) Public Health and Safety;  Journal of Neonatal Nursing ---Elsevier Division of Public Health and Primary Care, Oxford University, Oxford OX3 7LF, UK",+Breach of Policy by Author+Copyright Claims+Lack of Approval from Company/Institution+Lack of Approval from Third Party,Leona Bull,07/21/2010 00000000 10.1016/j.jnn.2010.04.002,08/01/2010 00000000 10.1016/j.jnn.2010.04.002,Research Article Retraction,United Kingdom No
