17277,"Comparing the Effects of Carvedilol Enantiomers on Regression of Established Cardiac Hypertrophy Induced by Pressure Overload (HSC) Medicine - Cardiology; (HSC) Medicine - Pharmacology; (HSC) Medicine - Rehabilitation/Therapy;  Laboratory Animal Research ---Korean Association for Laboratory Animal Science Institute of Biomedical and Pharmaceutical Technology (IBPT) ,Fuzhou University, Fuzhou, PR China Department of Pharmacology, College of Medicine and BK21 Chungbuk Biomedical Science Center, Chungbuk National University, Cheongju, Korea",+Error in Text,Jia Hao Chan-Hyung Kim,03/30/2010 00000000 10.5625/lar.2010.26.1.75,06/30/2010 00000000 10.5625/lar.2010.26.2.223,Research Article Correction,China South Korea No
12925,"Study on therapeutic effect of music therapy on patients with dental anxiety of college students (HSC) Medicine - Dentistry; (HSC) Medicine - Rehabilitation/Therapy; (HUM) Arts - Music;  2010 International Conference on E-Health Networking Digital Ecosystems and Technologies (EDT) ---Institute of Electrical and Electronics Engineers (IEEE) Hospital, Shijiazhuang Railway Institute, Shijiazhuang, 050043, Hebei, China Institutes of Zhongshan, university of electronic science and technology of china, 528402, Guangdong, China http://retractionwatch.com/2015/06/25/one-publisher-appears-to-have-retracted-thousands-of-meeting-abstracts-yes-thousands/",+Notice - Limited or No Information,Pu Cheng Rong Chen,04/17/2010  10.1109/EDT.2010.5496628,06/28/2010  10.1109/EDT.2010.5496628,Conference Abstract/Paper Retraction,China No
3241,"Effects of recombinant type 1 interferon therapy on human muscle diseases (BLS) Anatomy/Physiology; (BLS) Biology - Cellular; (BLS) Microbiology; (HSC) Medicine - Orthopedics;  Muscle & Nerve ---Wiley Weill Cornell Medical College, New York, NY, USA10065",+Notice - Limited or No Information+Plagiarism of Article+Withdrawal,Joerg-Patrick Stubgen,08/07/2009 20583118 10.1002/mus.21799,06/25/2010 19670318 10.1002/mus.21394,Research Article Retraction,United States No
5080,"Management of antidepressant withdrawal reactions (HSC) Medicine - Nursing; (HSC) Medicine - Psychiatry; (SOC) Psychology;  Journal of the American Academy of Nurse Practitioners ---Wiley University of Virginia School of Nursing, Charlottesville, VA",+Euphemisms for Plagiarism+Plagiarism of Text,Shelley Yerger Huffstutler,04/01/1998 9801549 10.1111/j.1745-7599.1998.tb01212.x,06/25/2010 20590961 10.1111/j.1745-7599.2010.00535.x,Case Report Review Article Retraction,United States No
15526,"Household' Health Crisis and Insurance Decision Management—The Effect of Poverty on Rural Household Health Risks and Isurance-Decision (B/T) Business - Economics; (HSC) Medicine - General; (PUB) Society/Association Journals; (SOC) Sociology;  2010 2nd International Conference on Advanced Computer Control ---Institute of Electrical and Electronics Engineers (IEEE) Study Center for Social Security in Wuhan University, Hubei, Wuhan http://retractionwatch.com/2015/06/25/one-publisher-appears-to-have-retracted-thousands-of-meeting-abstracts-yes-thousands/",+Notice - Limited or No Information,Hai-liang Huang,03/27/2010  10.1109/ICACC.2010.5487106,06/17/2010  10.1109/ICACC.2010.5487106,Conference Abstract/Paper Retraction,China No
13276,"Review on study of production efficiency in the medical service based on SFA (B/T) Business - Management; (B/T) Computer Science; (HSC) Medicine - General; (PUB) Society/Association Journals;  2010 2nd International Conference on Computer Engineering and Technology ---Institute of Electrical and Electronics Engineers (IEEE) Graduate School, Jiangxi University of Finance and Economic, Nan Chang City, 330013, China http://retractionwatch.com/2015/06/25/one-publisher-appears-to-have-retracted-thousands-of-meeting-abstracts-yes-thousands/",+Breach of Policy by Author+Investigation by Journal/Publisher+Notice - Limited or No Information,Tao Chun-hai,04/16/2010  10.1109/ICCET.2010.5486053,06/17/2010  10.1109/ICCET.2010.5486053,Conference Abstract/Paper Retraction,China No
2747,"Androgen Activates PEG10 to Promote Carcinogenesis in Hepatic Cancer Cells (BLS) Biology - Cancer; (BLS) Biology - Cellular; (BLS) Genetics; (HSC) Medicine - Oncology;  Oncogene ---Nature Publishing Group Department of Immunology, and Laboratory of Allergy and Clinical Immunology, Institute of Allergy and Immune-related Diseases and Medical Research Center, Wuhan University School of Medicine, Wuhan, China The State Key Laboratory of Molecular Biology, Institute of Biochemistry and Cell Biology, Shanghai Institutes for Biological Sciences, Chinese Academy of Science, Shanghai, ChinaDepartment of Infectious Diseases, Ruijin Hospital, Shanghai Second Medical University, Shanghai, China College of Life Sciences, South China Normal University, Guangzhou, China Department of Pharmacology, Wuhan University School of Medicine, Wuhan, China Department of Immunology, Tongji Medical College, Huazhong University of Science and Technology, Wuhan, China Department of Immunology, Fourth Military Medical University, Xian, China http://retractionwatch.com/2012/05/31/why-retraction-notices-matter-groups-repeated-misuse-of-figures-gets-different-play-from-five-journals/",+Notice - Limited or No Information,Xiong Jie Chen Lang Q Jian L Chaoqun Y Dehua S Yi J Yanping Xie Luokun Zhang Qiuping W Hui Gong Feili Jin Boquan Jin Youxin Tan Jinquan,04/28/2006 17369855 10.1038/sj.onc.1210362,06/16/2010 21677654 10.1038/onc.2011.66,Research Article Retraction,China No
4646,"Modelling subcortical bone in finite element analyses: A validation and sensitivity study in the macaque mandible (HSC) Radiology/Imaging;  Journal of Biomechanics ---Elsevier Functional Morphology and Evolution Unit, Hull York Medical School, University of York, UK Structure and Motion Laboratory, Department of Veterinary Basic Sciences, The Royal Veterinary College, University of London, UK Centre for Medical Engineering and Technology, University of Hull, UK http://retractionwatch.com/2015/04/22/skeleton-crews-second-paper-boned-over-methodology-issues-more-retractions-to-appear/",+Error in Data+Error in Methods+Error in Results and/or Conclusions,Olga Panagiotopoulou N Curtis P O’ Higgins S N Cobb,02/22/2010 20176361 10.1016/j.jbiomech.2009.12.027,06/12/2010 25977972 10.1016/j.jbiomech.2010.06.001,Research Article Correction,United Kingdom No
17878,"A review of developments into therapeutic running footwear research (B/T) Business - Manufacturing; (BLS) Anatomy/Physiology; (HSC) Medicine - Orthopedics;  Procedia Engineering ---Elsevier Liverpool John Moores University, School of Engineering, Liverpool, UK",+Plagiarism of Article,M R Shariatmadari R English G Rothwell,06/01/2010 00000000 10.1016/j.proeng.2010.04.071,06/11/2010 00000000 10.1016/j.proeng.2010.04.071,Review Article Retraction,United Kingdom Yes
3760,"Is it Science… or is it turf Guarding? (BLS) Anatomy/Physiology; (BLS) Biology - General; (HSC) Medicine - Diabetes;  Diabetes & Metabolic Syndrome ---Elsevier Editor-in-Chief   50, Manoel Gonsalves Rd., Bandra (W), Mumbai 400050, India",+Notice - Limited or No Information+Withdrawal,Shaukat M Sadikot,06/08/2010 00000000 10.1016/j.dsx.2010.05.020,06/08/2010 25376593 10.1016/j.dsx.2010.05.020,Commentary/Editorial Retraction,India No
16684,"Activation of Capsaicin-sensitive Primary Sensory Neurones Induces Anandamide Production and Release (BLS) Biology - Cellular; (BLS) Biology - General; (BLS) Biology - Molecular; (BLS) Neuroscience; (HSC) Medicine - Pharmacology;  Journal of Neurochemistry (JNC) ---Wiley Department of Anaesthetics and Intensive Care, Imperial College, Faculty of Medicine, Chelsea and Westminster Hospital, London, UK Novartis Institute of Medical Sciences, London, UK The Drug Discovery Center, Novartis Pharma AG, Basel, Switzerland http://retractionwatch.com/2011/08/24/another-retraction-for-jatinder-ahluwalia-in-journal-of-neurochemistry/ http://retractionwatch.com/2011/08/26/imperial-committee-to-weigh-validity-of-ahluwalias-phd-following-second-retraction/ http://retractionwatch.com/category/by-author/jatinder-ahluwalia/",+Error in Data+Error in Text,Jatinder Ahluwalia Mohammed Yaqoob Laszlo Urban Stuart Bevan Istvan Nagy,02/01/2003 12558978 10.1046/j.1471-4159.2003.01550.x,06/02/2010 12558978 10.1111/j.1471-4159.2010.06787.x,Research Article Correction,Switzerland United Kingdom No
4880,"Antidiabetogenic Effects of Chromium Mitigate Hyperinsulinemia-Induced Cellular Insulin Resistance via Correction of Plasma Membrane Cholesterol Imbalance (BLS) Biochemistry; (BLS) Biology - Cellular; (BLS) Biology - Molecular; (HSC) Medicine - Diabetes; (HSC) Medicine - Endocrinology;  Molecular Endocrinology ---Endocrine Society Department of Cellular and Integrative Physiology, Indiana University School of Medicine, Center for Diabetes Research, Indianapolis, Indiana 46202 Department of Biochemistry and Molecular Biology, Indiana University School of Medicine, Center for Diabetes Research, Indianapolis, Indiana 46202 Department of Molecular Cardiology, Joseph J Jacobs Center for Thrombosis and Vascular Biology, Cleveland Clinic, Cleveland, Ohio 44195 Eli Lilly and Company, Indianapolis, Indiana 46285 http://retractionwatch.com/2010/11/10/its-poll-time-should-a-retraction-during-graduate-school-mean-losing-your-phd/ http://retractionwatch.com/2010/10/26/third-retraction-for-indiana-university-scientist-who-altered-figures-in-nih-funded-research/",+Falsification/Fabrication of Data+Falsification/Fabrication of Image+Investigation by ORI+Manipulation of Images+Misconduct - Official Investigation/Finding+Misconduct by Author,Emily M Horvath Lixuan Tackett Alicia M McCarthy Priya Raman Joseph T Brozinick Jeffrey S Elmendorf,04/01/2008 18165437 10.1210/me.2007-0410,06/01/2010 20514688 10.1210/me.2010-0167,Research Article Retraction,United States No
2639,"Blockade of Allergic Airway Inflammation Following Systemic Treatment with a B7-Dendritic Cell (PD-L2) Cross-Linking Human Antibody (BLS) Biology - Cellular; (BLS) Biology - Molecular; (BLS) Microbiology; (HSC) Medicine - Immunology; (PUB) Society/Association Journals;  The Journal of Immunology : Official Journal of the American Association of Immunologists ---American Association of Immunologists Division of Allergic Disease and Internal Medicine, Department of Internal Medicine, Mayo Clinic College of Medicine, Mayo Clinic, Rochester, MN 55905, USA Neurology, Department of Internal Medicine, Mayo Clinic College of Medicine, Mayo Clinic, Rochester, MN 55905, USA Immunology,  Department of Internal Medicine, Mayo Clinic College of Medicine, Mayo Clinic, Rochester, MN 55905, USA",+Concerns/Issues About Data+Investigation by Company/Institution+Misconduct - Official Investigation/Finding+Misconduct by Author+Results Not Reproducible,Suresh Radhakrishnan Koji Iijima Takao Kobayashi Moses Rodriguez Hirohito Kita Larry R Pease,07/15/2004 15240731 10.4049/jimmunol.173.2.1360,06/01/2010 20483793 10.4049/jimmunol.1090032,Research Article Retraction,United States No
18644,"Depistage du cancer epidermoïde de l’oesophage par endoscopie chez les sujets a risque eleve de cancer (HSC) Biostatistics/Epidemiology; (HSC) Medicine - Gastroenterology; (HSC) Medicine - Oncology; (HSC) Public Health and Safety;  Acta Endoscopica ---Springer Réseau de cancérologie Oncomel, Lille, France Service des maladies de l’appareil digestif, CHU Pontchaillou, Rennes, France Commission sante publique de la SFED, Paris, France",+Error by Journal/Publisher+Retract and Replace,Eric Vaillant Denis Heresbach Anne Calazel Thierry Ponchon,02/01/2010 00000000 10.1007/s10190-010-0001-7,06/01/2010 00000000 10.1007/s10190-010-0001-7,Research Article Retraction,France No
1561,"Dual blockade of the renin-angiotensin system in chronic renal disease: to do or not to do (HSC) Medicine - Internal;  Clinical and Experimental Nephrology ---Springer Kaikou-Kai Central Clinic, Division of Nephrology, Nagaya Kyoritsu Hospital, Nagoya, Japan",+Cites Prior Retracted Work,Naoyuki Nakao Hachiro Seno Hirotake Kasuga Takanobu Toriyama Hirohisa Kawahara,09/01/2004 15480894 10.1007/s10157-004-0307-x,06/01/2010 20505972 10.1007/s10157-010-0297-9,Research Article Retraction,Japan
1977,"Elevated Serum S100B Protein in First-episode Drug-naïve Chinese Patients With Schizophrenia (BLS) Biology - Molecular; (BLS) Neuroscience; (HSC) Medicine - Psychiatry;  Schizophrenia Research ---Elsevier Center for Biological Psychiatry, Beijing Hui-Long-Guan Hospital, Beijing 100096, PR China Department of Psychiatry, Yale University School of Medicine, New Haven, CT 06520, USA Institute of Mental Health, Peking University, 53 Huayuan North Road, Haidian District, Beijing 100191, PR China Menninger Department of Psychiatry, Baylor College of Medicine, Houston, Texas 77030, USA Institute of Mental Health, Peking University, 53 Huayuan North Road, Haidian District, Beijing 100191, PR China",+Error in Data+Unreliable Data,Yunlong Tan Xingguang Luo Fude Yang Wufang Zhang Zhiren Wang Yizhuang Zou Xiangyang Zhang Fei Wang Lingjun Zuo Dongfeng Zhou,02/18/2010,06/01/2010 20163935 10.1016/j.schres.2010.01.012,Research Article Retraction,China United States No
3375,"Induction of a gene expression program in dendritic cells with a cross-linking IgM antibody to the co-stimulatory molecule B7-DC (BLS) Biology - Cellular; (BLS) Biology - Molecular; (BLS) Genetics; (BLS) Neuroscience; (HSC) Medicine - Immunology;  FASEB Journal : Official Publication of the Federation of American Societies for Experimental Biology ---Federation of American Societies for Experimental Biology Department of Immunology, Mayo Clinic, College of Medicine, 200 First St. S.W., Rochester, MN 55905, USA http://retractionwatch.com/2011/01/26/how-should-authors-mark-retracted-papers-on-their-cvs-compare-a-chronic-lyme-doctor-with-one-from-the-mayo/",+Concerns/Issues About Data+Investigation by Company/Institution+Misconduct - Official Investigation/Finding+Misconduct by Author+Results Not Reproducible,Frank A Blocki Suresh Radhakrishnan Virginia P Van Keulen Karin L Heckman Bogoljub Ciric Charles L Howe Moses Rodriguez Eugene Kwon Larry R Pease,11/01/2006 17023390 10.1096/fj.06-6171fje,06/01/2010 20515957 10.1096/fj.06-6171fjeRET,Research Article Retraction,United States Yes
2641,"Induction of a Th1 Response from Th2-Polarized T Cells by Activated Dendritic Cells: Dependence on TCR:Peptide-MHC Interaction, ICAM-1, IL-12, and IFN-gmma (BLS) Biology - Cellular; (BLS) Microbiology; (HSC) Medicine - Immunology; (PUB) Society/Association Journals;  The Journal of Immunology : Official Journal of the American Association of Immunologists ---American Association of Immunologists Division of Gastroenterology, Department of Internal Medicine, Mayo Clinic College of Medicine, Mayo Clinic, Rochester, MN 55905, USA Department of Immunology, Department of Internal Medicine, Mayo Clinic College of Medicine, Mayo Clinic, Rochester, MN 55905, USA",+Concerns/Issues About Data+Investigation by Company/Institution+Misconduct - Official Investigation/Finding+Misconduct by Author+Results Not Reproducible,Suresh Radhakrishnan Karla R Wiehagen Vesna Pulko Virginia Van Keulen William A Faubion Keith L Knutson Larry R Pease,03/15/2007 17339455 10.4049/jimmunol.178.6.3583,06/01/2010 20483795 10.4049/jimmunol.1090034,Research Article Retraction,United States No
4051,"Is Chaalia/Pan Masala harmful for health? practices and knowledge of children of schools in Mahmoodabad and Chanesar Goth, Karachi (HSC) Medicine - Pediatrics; (HSC) Public Health and Safety; (PUB) Society/Association Journals; (SOC) Education;  The Journal of the Pakistan Medical Association (JPMA) ---Pakistan Medical Association Department of Family Medicine, Aga Khan University and Hospital, Stadium Road, KarachiDepartment of Community Health Sciences, Aga Khan University and Hospital, Stadium Road, Karachi",+Duplication of Article+Error by Journal/Publisher,Sameena Shah Riaz Qureshi Iqbal Azam,08/01/2009 19757704,06/01/2010 20535878,Research Article Retraction,Pakistan No
2638,"Naturally Occurring Human IgM Antibody That Binds B7-DC and Potentiates T Cell Stimulation by Dendritic Cells (BLS) Biology - Cellular; (BLS) Microbiology; (HSC) Medicine - Immunology; (PUB) Society/Association Journals;  The Journal of Immunology : Official Journal of the American Association of Immunologists ---American Association of Immunologists Department of Oncology, Johns Hopkins University School of Medicine, Baltimore, MD 21205, USA Internal Medicine, Mayo Medical and Graduate Schools, Mayo Clinic, Rochester, MN 55905, USA Immunology, Mayo Medical and Graduate Schools, Mayo Clinic, Rochester, MN 55905, USA Neurology, Mayo Medical and Graduate Schools, Mayo Clinic, Rochester, MN 55905, USA",+Concerns/Issues About Data+Investigation by Company/Institution+Misconduct - Official Investigation/Finding+Misconduct by Author+Results Not Reproducible,Suresh Radhakrishnan Loc T Nguyen Bogoljub Ciric Daren R Ure Bin Zhou Koji Tamada Haidong Dong Su-Yi Tseng Tahiro Shin Drew M Pardoll Lieping Chen Robert A Kyle Moses Rodriguez Larry R Pease,02/15/2003 12574348 10.4049/jimmunol.170.4.1830,06/01/2010 20483792 10.4049/jimmunol.1090031,Research Article Retraction,United States No
1591,"Preliminary study of the effects of Tai Chi and Qigong medical exercise on indicators of metabolic syndrome and glycaemic control in adults with raised blood glucose levels (HSC) Medicine - Alternative; (HSC) Medicine - Diabetes; (HSC) Medicine - Sports;  British Journal of Sports Medicine ---BMJ Publishing University of Queensland, St Lucia Queensland, Australia",+Notice - Limited or No Information,X Liu YD Miller NW Burton WJ Brown,10/16/2008 18927159 10.1136/bjsm.2008.051144,06/01/2010 20547669 10.1136/bjsm.2007.045476retract,Research Article Retraction,Australia Yes
2642,"Reprogrammed FoxP3+ T Regulatory Cells Become IL-17+ Antigen-Specific Autoimmune Effectors In Vitro and In Vivo (BLS) Biology - Cellular; (BLS) Microbiology; (HSC) Medicine - Immunology; (PUB) Society/Association Journals;  The Journal of Immunology : Official Journal of the American Association of Immunologists ---American Association of Immunologists Department of Immunology, College of Medicine, Mayo Clinic, Rochester, MN 55905, USA Department of Molecular Pharmacology and Experimental Therapeutics, College of Medicine, Mayo Clinic, Scottsdale, AZ 85259, USA",+Concerns/Issues About Data+Investigation by Company/Institution+Misconduct - Official Investigation/Finding+Misconduct by Author+Results Not Reproducible,Suresh Radhakrishnan Rosalyn Cabrera Erin L Schenk Pilar Nava-Parada Michael P Bell Virginia P Van Keulen Ronald J Marler Sara J Felts Larry R Pease,09/01/2008 18713984 10.4049/jimmunol.181.5.3137,06/01/2010 20483796 10.4049/jimmunol.1090035,Research Article Retraction,United States No
1053,"Shed blood transfusion and its effect on postoperative fever: a comparative study (BLS) Biology - Cellular; (BLS) Biology - General; (HSC) Medicine - Surgery;  Archives of Orthopedic and Trauma Surgery ---Springer - Nature Publishing Group Department of Orthopedics and Traumatology Afyon Kocatepe University, School of Medicine Afyon Turkey",+Copyright Claims+Withdrawal,Levent Altinel Kamil Cagri Kose Volkan Ergan,09/27/2006,06/01/2010 17004078 10.1007/s00402-006-0215-5,Research Article Retraction,Turkey
2643,"TREM-2 Mediated Signaling Induces Antigen Uptake and Retention in Mature Myeloid Dendritic Cells (BLS) Biology - Cellular; (BLS) Microbiology; (HSC) Medicine - Immunology; (PUB) Society/Association Journals;  The Journal of Immunology : Official Journal of the American Association of Immunologists ---American Association of Immunologists Pathology and Immunology Program, Washington University School of Medicine, St. Louis, MO 63110, USA Department of Neurology, College of Medicine, Mayo Clinic, Rochester, MN 55905, USA Department of Immunology, College of Medicine, Mayo Clinic, Rochester, MN 55905, USA",+Concerns/Issues About Data+Investigation by Company/Institution+Misconduct - Official Investigation/Finding+Misconduct by Author+Results Not Reproducible,Suresh Radhakrishnan Laura N Arneson Jadee L Upshaw Charles L Howe Sara J Felts Marco Colonna Paul J Leibson Moses Rodriguez Larry R Pease,12/01/2008 19017976 10.4049/jimmunol.181.11.7863,06/01/2010 20483797 10.4049/jimmunol.1090036,Research Article Retraction,United States No
388,"Transurethral ultrasonography-guided injection of adult autologous stem cells versus transurethral endoscopic injection of collagen in treatment of urinary incontinence (HSC) Medicine - Urology/Nephrology;  World Journal of Urology ---Springer Department of Urology, Medical University of Innsbruck, Innsbruck, AustriaInstitute of Biochemical Pharmacology,Medical University of Innsbruck, Innsbruck, AustriaDepartment of Radiology, Medical University of Innsbruck, Innsbruck, AustriaDepartment of Otolaryngology, Sisters of Charity Hospital, Wels, Austria",+Notice - Limited or No Information,Hannes Strasser Rainer Marksteiner Eva Margreiter Michael Mitterberger Germar Michael Pinggera Ferdinand Frauscher Martin Fussenegger Kurt Kofler Georg Bartsch,08/14/2007 17701044 10.1007/s00345-007-0190-7,05/25/2010 20499238 10.1007/s00345-010-0568-9,Clinical Study Research Article Retraction,Austria Yes
18578,"Antioxidant-induced modification of INrf2 cysteine 151 and PKC-delta-mediated phosphorylation of Nrf2 serine 40 are both required for stabilization and nuclear translocation of Nrf2 and increased drug resistance (HSC) Medicine - Pharmacology;  Journal of Cell Science ---The Company of Biologists Department of Pharmacology and Experimental Therapeutics, University of Maryland School of Medicine, Baltimore, MD 21201, USA http://retractionwatch.com/2017/02/16/cancer-biologist-stops-research-retraction-count-rises-13/",+Error in Text,Suryakant K Niture Abhinav K Jain Anil K Jaiswal,12/15/2009 19920073 10.1242/jcs.058537,05/19/2010 19920073 10.1242/jcs.074286,Research Article Correction,United States No
447,"In silico screening of herbal and nanoparticle lead compounds for effectivity against H5N1, H1N1 neuraminidase and telomerase (BLS) Biology - Molecular; (HSC) Medicine - Drug Design;  BMC Bioinformatics ---BioMed Central (BMC) The Eighth Asia Pacific Bioinformatics Conference (APBC 2010) Bangalore, India http://retractionwatch.com/2014/02/14/pseudoknots-a-pseudopaper-retracted-for-plagiarism/",+Plagiarism of Article,Sayak Ganguli Manjita Mazumder Protip Basu Paushali Roy Sayani Mitra Abhijit Datta,01/18/2010 20122184 10.1186/1471-2105-11-S1-S13,05/18/2010 20482900 10.1186/1471-2105-11-258,Research Article Retraction,India No
2213,"The effect of intravaginal applied GnRH-agonist on the time of ovulation and subsequent reproductive performance of weaned multiparous sows (HSC) Medicine - Obstetrics/Gynecology; (HSC) Veterinary Science; (PUB) Society/Association Journals;  Reproduction in Domestic Animals ---Wiley BC Osijek, Croatia",+Concerns/Issues About Data+Euphemisms for Plagiarism+Plagiarism of Article,C Baer G Bilkei,09/13/2004 15367259 10.1111/j.1439-0531.2004.00500.x,05/18/2010 20586955 10.1111/j.1439-0531.2010.01644.x,Research Article Retraction,Croatia No
5017,"Slavery and medicine in the Caribbean at the end of the Ancien Régime (HSC) Medicine - General; (HUM) History - North America;  Social History ---Taylor and Francis Florida International University, Miami, Florida",+Euphemisms for Plagiarism+Plagiarism of Article,José María Aguilera-Manzano,02/25/2010  10.1080/03071020802410312,05/17/2010  10.1080/03071021003729971,Research Article Retraction,United States No
10818,"Educational Practice of Computer Science in Medical Imaging (B/T) Computer Science; (HSC) Radiology/Imaging; (PUB) Society/Association Journals; (SOC) Education;  2010 Second International Workshop on Education Technology and Computer Science ---Institute of Electrical and Electronics Engineers (IEEE) Med. Imaging Dept., Tianjin Med. Univ., Tianjin, China http://retractionwatch.com/2015/06/25/one-publisher-appears-to-have-retracted-thousands-of-meeting-abstracts-yes-thousands/",+Investigation by Journal/Publisher+Notice - Limited or No Information,Zhang Xue-jun Guo Hong Zhang Yun-ting Li Ying Guo Li,03/06/2010  10.1109/ETCS.2010.162,05/06/2010  10.1109/ETCS.2010.162,Conference Abstract/Paper Retraction,China No
2568,"Association of physical fitness with health-related quality of life in Finnish young men (BLS) Anatomy/Physiology; (HSC) Medicine - Sports; (HSC) Public Health and Safety; (PUB) Society/Association Journals;  Quality of Life Research: An International Journal of Quality of Life Aspects of Treatment, Care and Rehabilitation ---Springer Department of Physical Medicine and Rehabilitation Central Hospital JyväskyläDepartment of Health Sciences University of JyväskyläUKK Institute for Health Promotion Research TampereThe National Institute for Health and Welfare HelsinkiDefence Command Personnel Division Finnish Defence Forces HelsinkiDepartment of Biology of Physical Activity University of Jyväskylä",+Error by Journal/Publisher,Arja Hakkinen Marjo Rinne Tommi Vasankari Matti Santtila Keijo Hakkinen Heikki Kyrolainen,02/10/2010 20146010 10.1007/s11136-010-9595-7,05/01/2010 20146010 10.1007/s11136-010-9595-7,Research Article Retraction,Finland No
1433,"Common Colds. Causes, Potential Cures, and Treatment (BLS) Biology - Molecular; (BLS) Microbiology; (HSC) Medicine - Internal;  Canadian Family Physician Médecin de Famille Canadien ---College of Family Physicians of Canada Royal Alexandra Hospital, Edmonton, Canada",+Plagiarism of Article+Plagiarism of Data,H G Saroea,10/01/1993 8219868,05/01/2010 20463268,Research Article Retraction,Canada No
