citfunc,sectitle,refentry,art,sectype,sectype2,refid,sec,ctx,pointerlist,nbcontexts,nbsections,itrp,anchorsent,partext,potential_cf,annotator,dataset
"includes excerpt from","conclusion","","10.1080/10572252.2013.816487","conclusions","","","","","","","","","additionally, wakefield’s word choice in the article creates a subtle message regarding the connection between the mmr and autism. at one point in the article, he stated, ‘‘rubella virus is associated with autism and the combined measles, mumps, and rubella vaccine (rather than monovalent measles vaccine) has also been implicated’’ (wakefield et al., 1998, p. 640). words such as ‘‘linked,’’ ‘‘associated,’’ and ‘‘implicated’’ frequently appear in sentences discussing the mmr vaccine and its involvement in the syndrome wakefield described in the article. although wakefield may deny proving a relationship between mmr and asd, his word choice scattered throughout the article subtly implied that a link does, indeed, exist.","","","includes excerpt from","coci_wakefield_ret_intext_ref.csv"
"discusses","conclusion","","10.1080/10572252.2013.816487","conclusions","","","","","","","","","a key passage in the article contains several of the various rhetorical strategies explored above, demonstrating how they function to make the article seem to simultaneously declare and deny a causal link between the mmr vaccine and autism. early in the discussion section, the wakefield et al. (1998) article reads, 
intestinal and behavioral pathologies may have occurred together by chance, reflecting a selection bias in a self-referred group; however, the uniformity of the intestinal pathological changes and the fact that previous studies have found intestinal dysfunction in children with autistic-spectrum disorders suggests that the connection is real and reflects a unique disease progress. (p. 639)","","","discusses","coci_wakefield_ret_intext_ref.csv"
"qualifies","conclusion","","10.1080/10572252.2013.816487","conclusions","","","","","","","","","significantly, this passage introduces a shift in the overall article; what follows becomes much more speculative as wakefield leads the reader from a discussion about a possible link between bowel problems and asd into a hypothetical exploration of why the mmr vaccine might be the causal factor at work. 
given these carefully constructed claims and cautiously hedged comments, readers clearly see how the wakefield et al. (1998) article came to be interpreted as claiming that a link between autism and the mmr existed. at the press conference to promote the article, wakefield made explicit what was implicit in the published text.","","","qualifies","coci_wakefield_ret_intext_ref.csv"
"obtains background from","conclusion","","10.1080/10572252.2013.816487","conclusions","","","","","","","","","shortly after the wakefield et al. (1998) article’s initial publication and the related press conference, two distinct interpretations of the article emerged among scientists, for the most part dictated by the context within which individuals read the article. as fahnestock (1986) noted, ‘‘much of the relevance of scientific articles is extratextual, not spelled out in the discourse but supplied by context, by the assumed inferences the intended audience will make’’ (p. 278).","","","obtains background from","coci_wakefield_ret_intext_ref.csv"
"discusses","conclusion","","10.1080/10572252.2013.816487","conclusions","","","","","","","","","the first interpretation of the wakefield et al. (1998) article argued that it did more harm than good to public health in the way it hinted at a causal link between the mmr vaccine and autism. those supporting such a reading challenged whether the article should have been published, based on its scientific shortcomings as well as its potentially negative impact on public health.","","","discusses","coci_wakefield_ret_intext_ref.csv"
"cites as evidence","conclusion","","10.1080/10572252.2013.816487","conclusions","","","","","","","","","but rather than reading the hedges in the wakefield et al. article as a way of introducing ideas in a scientifically responsible and acceptable way (their traditional use in a technical context), chen and destefano interpreted them like a nontechnical audience would, as more declarative than speculative. 
others in the scientific community would also apply this mixed reading strategy to the wakefield et al. (1998) article. less than a month after publication, the lancet published seven letters in the correspondence section commenting on the publication of the article (beale, 1998; bedford et al., 1998; black, prempeh, & baxter, 1998; lee et al., 1998; lindley & milla, 1998; o’brien, jones, & christie, 1998; payne & maxon, 1998).","","","cites as evidence","coci_wakefield_ret_intext_ref.csv"
"discusses","conclusion","","10.1080/10572252.2013.816487","conclusions","","","","","","","","","however, there are enough references in the text to lead the reader to the assumption that there is sufficient evidence provided by the study, and by other scientific publications, to suggest that there is a likely (although as yet unproven) link. (p. 905) 
the writers of this letter directly acknowledged that the wakefield et al. (1998) article explicitly denied proving a link, but they argued that the article, as written, contained hints that implicitly assert the existence of such a link. the hedged statements noted in the analysis above created these hints, and for these commentators, the implicit message they identified made the article problematic, regardless of any denial it contained, because of the potential for this underlying message to dominate public interpretation.","","","discusses","coci_wakefield_ret_intext_ref.csv"
"discusses","conclusion","","10.1080/10572252.2013.816487","conclusions","","","","","","","","","a second interpretation of the article emerged in the responses provided to these critiques of the wakefield et al. (1998) article. these responses justified the decision to publish the study and defended the article as not making a claim regarding a link between mmr and autism.","","","discusses","coci_wakefield_ret_intext_ref.csv"
"discusses","conclusion","","10.1080/10572252.2013.816487","conclusions","","","","","","","","","he began by declaring, ‘‘the paper by andrew wakefield and colleagues is an example of how researchers, editors and those concerned with the public’s health can work together to present new evidence in a scientifically balanced and careful way [emphasis added]’’ (p. 908). horton placed the wakefield et al. (1998) study firmly within the realm of science, describing it as an exemplar for maintaining scientific commitments while addressing issues with public relevance. he read the hedged statements in the discussion section in a technical context, interpreting them as a cautious presentation of new ideas.","","","discusses","coci_wakefield_ret_intext_ref.csv"
"discusses","conclusion","","10.1080/10572252.2013.816487","conclusions","","","","","","","","","the respondents who defended the wakefield et al. (1998) article (horton, 1998; murch, thomson, & walker-smith, 1998; wakefield, 1998) took the article at face value. they read it in the context of a technical sphere and assumed a technical reader who would understand the limitations of the study and also be familiar with how to interpret the hedges contained in the article.","","","discusses","coci_wakefield_ret_intext_ref.csv"
"discusses","conclusion","","10.1080/10572252.2013.816487","conclusions","","","","","","","","","myers (1990) argued, ‘‘the fate of a claim is not decided when it is published, even when it is published in nature or science; it depends on who reads it, how it is read, and how it is used’’ (p. 100). in the media, the claims of the wakefield et al. (1998) article were, for the most part, read as determining a link between mmr and autism (e.g., see bbc, 1998; bedford & elliman, 1998; ‘‘mmr vaccination comes,’’ 1998; royal free hospital school of medicine, 1998). (for more recent examples, see de lange, 2011; godlee, smith, & marcovitch, 2011; shapiro, 2011.)","","","discusses","coci_wakefield_ret_intext_ref.csv"
"discusses","conclusion","","10.1080/10572252.2013.816487","conclusions","","","","","","","","","in one article (bedford & elliman, 1998), the first sentence noted, ‘‘the media excitement and public concern after a lancet report linking [emphasis added] measles, mumps, and rubella (mmr) vaccine with autism kindles a sense of de ́ja` vu’’ (p. 715). despite the denial in the wakefield et al. (1998) article, this news story described the article as establishing a link. meanwhile, the bbc news story carried the headline ‘‘child vaccine linked [emphasis added] to autism’’ (bbc, 1998).","","","discusses","coci_wakefield_ret_intext_ref.csv"
"discusses","conclusion","","10.1080/10572252.2013.816487","conclusions","","","","","","","","","these headlines and lead-ins dropped the hedges of the original article, broadening wakefield’s qualified, speculative claims about the possibility of a link to declarative statements about the existence of such a connection. 
yet another interpretation of the wakefield et al. (1998) article surfaced in 2004 when journalist brian deer published an investigative report that raised doubts about the study by uncovering a conflict of interest on wakefield’s part (see deer, 2004, 2011a, 2011b, 2011c). deer’s report revealed that, while conducting the 12-child case study, wakefield received money from a lawyer building a legal case against mmr manufacturers for parents of autistic children (deer, 2011b, p. 136).","","","discusses","coci_wakefield_ret_intext_ref.csv"
"discusses","conclusion","","10.1080/10572252.2013.816487","conclusions","","","","","","","","","that same year, 10 of wakefield’s 12 original coauthors issued a ‘‘retraction of an interpretation’’ to explicitly renege the suggestion of a link between mmr and autism (murch et al., 2004). 
six years later, the lancet officially retracted the wakefield et al. (1998) article, stating, 
it has become clear that several elements of the 1998 paper by wakefield et al. are incorrect . . . the claims in the original paper that children were ‘‘consecutively referred’’ and that investigations were ‘‘approved’’ by the local ethics committee have been proven to be false (editors of the lancet, 2010, p. 445).","","","discusses","coci_wakefield_ret_intext_ref.csv"
"qualifies","conclusion","","10.1080/10572252.2013.816487","conclusions","","","","","","","","","part of the continuing influence of the wakefield et al. (1998) article comes from wakefield’s utilization of the very norms of scientific writing—particularly hedges and passive voice—in combination with strategic word choice to create an ambiguous text open to conflicting interpretations. thus, this article illuminates the potential harm associated with the very practices of science publication practices meant to protect it from authorizing unproven claims.","","","qualifies","coci_wakefield_ret_intext_ref.csv"
"discusses","conclusion","","10.1080/10572252.2013.816487","conclusions","","","","","","","","","this observation notes the central place of publication in the expansion of scientific knowledge. however, as evidenced by the wakefield et al. (1998) article, publication represents only the beginning in the rhetorical life of scientific knowledge. as i have shown, what is cited or credited to a particular article occasionally may differ significantly from what is explicitly printed.","","","discusses","coci_wakefield_ret_intext_ref.csv"
"discusses","conclusion","","10.1080/10572252.2013.816487","conclusions","","","","","","","","","as the ongoing debate over the avc illustrates, scientists may need to think more carefully about the different interpretations of their claims that might emerge among different audiences in different contexts. 
additionally, the case of the wakefield et al. (1998) article draws attention to problems with the increasing tendency of scientists to bypass community checks and engage in ‘‘science by press conference’’ (moore, 2006). the discursive gaps created by hedging may be easy to take advantage of as information passes from a technical context into a public context, such as when promoting scientific publications through press conferences.","","","discusses","coci_wakefield_ret_intext_ref.csv"
"discusses","conclusion","","10.1080/10572252.2013.816487","conclusions","","","","","","","","","studying the reception of the avc among the public may be one particularly promising place to start. 
the role of the wakefield et al. (1998) article in the origins of the avc reveals the importance of scientific peer review not just in monitoring the expansion of scientific knowledge but also in influencing the ebb and flow of public discourse about science.","","","discusses","coci_wakefield_ret_intext_ref.csv"
"discusses","the psychology of vaccine hesitancy","","10.1586/14760584.2014.928208","","","","","","","","","","however, the success of these programs has been challenged recently by the rapid dissemination of anti-vaccination information. perhaps the most famous examples of this include concerns related to whether the mmr vaccine causes autism as suggested by a since withdrawn article in the lancet [4–6], and fears about the thimerosal preservative being associated with autism, a claim that has also been disproven [6,7]. despite public health officials and scientific evidence disputing these allegations, the rapid spread of anti-vaccination beliefs and their persistence led to a decline in vaccine coverage and subsequent outbreaks of vaccine preventable diseases.","","","discusses","coci_wakefield_ret_intext_ref.csv"
"cites for information","the psychology of vaccine hesitancy","","10.1586/14760584.2014.928208","","","","","","","","","","in the past, the ability of antivaccination lobby groups to communicate with these individuals was limited due to public health’s control over most of the major sources of information dissemination. however, as illustrated by the mmr and thimerosal examples, this has now changed [4–7]. the best mechanism for public health officials to influence individuals between the two extremes remains uncertain, but there are some factors that we do know are important.","","","cites for information","coci_wakefield_ret_intext_ref.csv"
"qualifies","","","10.1111/cea.12325","","","","","","","","","","current figures show that 8% of 10‐ to 16‐year‐olds are not vaccinated with mmr 3. most attention has been focussed on the proposed 4, but discredited 5 link between the mmr vaccine and autism. however, another reason is the perceived risk, in children with egg allergy, of reaction to the vaccine, which contains attenuated virus grown on chick fibroblasts.","","","qualifies","coci_wakefield_ret_intext_ref.csv"
"describes","vaccine hesitancy and vaccine refusal","","10.1007/s40124-014-0052-x","","","","","","","","","","notably, a recent case–control study encompassing more than 2 million children, found no evidence of an association between whole cell pertussis vaccine and the occurrence of encephalopathy [16].
in the late 1990s, andrew wakefield, a british gastroenterologist, proposed an association between measles vaccine and autism [17]. mmr coverage rates in the uk decreased from >90 % in 1995 to 80 % in 2003 (with pockets of lower vaccine coverage).","","","describes","coci_wakefield_ret_intext_ref.csv"
"credits","the context","","10.1111/1468-2230.12082","","","","","","","","","","though usually given to young children, it can also be given to older children and adults.
l and m's parents, like many other parents at the time, decided against inoculating their young children due to safety concerns identified in a paper published in the lancet 8 and much publicised by the media. 9 at first, the risks posed to the un‐inoculated were negligible.","","","credits","coci_wakefield_ret_intext_ref.csv"
"discusses","mothers’ engagement with responsible health practices","","10.1002/9781118898345.ch3","","","","","","","","","","in research conducted by the sj and a colleague, mothers’ negotiation of decisions in relation to their child’s health; childhood immunisation, specifically the combined measles, mumps and rubella (mmr) vaccination, was explored. since the controversy (widely covered in the media) surrounding the mmr vaccination erupted following a report by wakefield et al. (1998) that linked the mmr vaccination to autism and crohn’s disease there has been a proliferation of research investigating its impact on the uptake of the mmr. in 2010 the journal retracted the original paper (editors 2010).","","","discusses","coci_wakefield_ret_intext_ref.csv"
"describes","examples of dual-map overlays","","10.1002/9781118858080.ch7","","","","","","","","","","in 1998, a paper by wakefield et al. appeared in lancet (wakefield et al., 1998). it suggested a possible link between a combination of vaccines against measles, mumps, rubella, and autism.","","","describes","coci_wakefield_ret_intext_ref.csv"
"obtains background from","examples of dual-map overlays","","10.1002/9781118858080.ch7","","","","","","","","","","we explain one example of single-source overlays in detail here. the seed article in the example, wakefield et al. (1998), is a highly cited retracted article, which has profound implications on public health, especially on vaccine uptakes from children.","","","obtains background from","coci_wakefield_ret_intext_ref.csv"
"obtains background from","examples of dual-map overlays","","10.1002/9781118858080.ch7","","","","","","","","","","we use the wakefield paper as an example to illustrate various patterns that can be discerned from a dual-map overlay (wakefield et al., 1998). the source of the overlay is a set of 405 articles that cited the wakefield paper (this is a subset because of the limitation of our web of science subscription).","","","obtains background from","coci_wakefield_ret_intext_ref.csv"
"describes","infants: 2 months to 2 years ","","10.1201/b17276-9","","","","","","","","","","intestinal pathology: gi symptom frequency in autism has received recent attention in the published literature.154 an early report published in the lancet in february 1998 described 12 children with gi pathology and autism.155 further work characterized a panenterocolitis in children with developmental disorders and concluded that a new variant of inflammatory bowel disease was present in that group of children.156","","","describes","coci_wakefield_ret_intext_ref.csv"
"discusses","","","10.3399/bjgp14x680977","introduction","","","","","","","","","in england and wales, the decline in the uptake of the combined measles, mumps, and rubella (mmr) vaccine following wakefield et al’s now discredited study1 continues to reverse.2 however, at 92% (first dose by 24 months) and 88% (first and second dose by 5 years), it remains below the 95% target required for population immunity.3","","","discusses","coci_wakefield_ret_intext_ref.csv"
"discusses","myth: mmr vaccines cause autism","","10.1097/01.jaa.0000451873.94189.56","","","","","","","","","","the first was a 1982 film called dpt [sic]: vaccine roulette that claimed a link between the dtp (diphtheria, tetanus, pertussis) vaccine and neurodevelopmental disorders. the second was a 1998 paper by andrew wakefield published in the lancet that purported a link between autism and the mmr (measles, mumps, rubella) vaccine; the article was later retracted.11,12 numerous studies have refuted any link between vaccines and autism or neuro developmental disorders.","","","discusses","coci_wakefield_ret_intext_ref.csv"
"credits","myth: mmr vaccines cause autism","","10.1097/01.jaa.0000451873.94189.56","","","","","","","","","","concerns about the dtp vaccine were followed by a new focus on the mmr vaccine and asds. this was largely due to the wakefield paper, which hypothesized that the mmr vaccine caused a reaction in the gut (ileo-cecal lymphoid nodular hyperplasia), that led to a release of brain-damaging peptides that increased asd risk.11 wakefield and his team looked at only 12 children.","","","credits","coci_wakefield_ret_intext_ref.csv"
"cites as evidence","experimental findings and discussion","","10.1109/asonam.2014.6921609","","","","","","","","","","fi-bromyalgia is a class of disorders related to the body's processing of pain which recent evidence suggests may have a potential connection with the asd [10]. similarly, although now discredited, previous research had suggested a causal link between children being vaccinated and developing autism [27]. these examples are further evidence of the type of powerful information which can be harvested from twitter.","","","cites as evidence","coci_wakefield_ret_intext_ref.csv"
"discusses","","","10.1038/512351f","introduction","","","","","","","","","he recalled that as a postdoc, he once tried to replicate the results of a study published in a top-tier journal, only to discover later that the reported data had been misinterpreted, making it impossible to repeat the experiment.
the study authors noted that fraudulent clinical findings can also be harmful to patient health — citing the case of a now-discredited 1998 paper that incorrectly suggested a link between childhood vaccinations and autism (a. j. wakefield et al. lancet 351, 637–641; 1998). that paper, they wrote, “helped to dissuade many parents from obtaining vaccination for their children”.","","","discusses","coci_wakefield_ret_intext_ref.csv"
"disputes","what is bias in relation to research and why is understanding bias important?","","10.1136/eb-2014-101946","","","","","","","","","","understanding research bias is important for several reasons: first, bias exists in all research, across research designs and is difficult to eliminate; second, bias can occur at each stage of the research process; third, bias impacts on the validity and reliability of study findings and misinterpretation of data can have important consequences for practice. the controversial study that suggested a link between the measles-mumps-rubella vaccine and autism in children2 resulted in a rare retraction of the published study because of media reports that highlighted significant bias in the research process.3 bias occurred on several levels: the process of selecting participants was misrepresented; the sample size was too small to infer any firm conclusion from the data analysis and the results were overstated which suggested caution against widespread vaccination and an urgent need for further research.","","","disputes","coci_wakefield_ret_intext_ref.csv"
"qualifies","","","10.7554/elife.02956","conclusions","","","","","","","","","the greatest costs of misconduct, preventable illness or the loss of human life due to misinformation in the medical literature, were not directly assessed. for example, a now-discredited article purporting a link between vaccination and autism (wakefield et al., 1998) helped to dissuade many parents from obtaining vaccination for their children. decreasing vaccination rates are often associated with outbreaks of preventable infections, such as a recent measles outbreak in wales that resulted in more than 1200 cases and cost an estimated £470,000 (∼$800,000 us) (mcwatt, 2013)","","","qualifies","coci_wakefield_ret_intext_ref.csv"
"discusses","the trust model: rationale","","10.1007/s11673-014-9570-z","","","","","","","","","","the infamous example of dr. andrew wakefield offers a case study of where the intersection between research and therapy has been exploited. in 1998, wakefield and 12 co-authors published a study in the lancet advancing a causal link between the measles, mumps, and rubella (mmr) vaccine and autism (wakefield et al. 1998). six years later, sunday times reporter brian deer unearthed a series of wakefield’s undisclosed financial conflicts of interest (deer 2004), which resulted in a lengthy professional misconduct hearing by the british general medical council (from july 2007 to may 2010) and global notoriety.","","","discusses","coci_wakefield_ret_intext_ref.csv"
"cites as evidence","","","10.1002/bies.201400075","introduction","","","","","","","","","the designation “autism spectrum disorder” (asd) refers to a group of heterogeneous neurodevelopmental disorders with multiple causes and courses, a significant range in severity of symptoms, and several associated co‐morbid disorders, including anxiety and gastrointestinal (gi) symptoms. the presence of gi symptoms has led to many speculations about a possible etiological role of alterations in gut‐brain interactions, starting with the infamous and later retracted lancet report by wakefield et al. 1, and resulting in several (failed) treatment strategies. more recently, the interest in brain gut interactions in asd has led to an appreciation that altered interactions between the gut microbiome and the brain (fig. 1) might not only play a role in asd pathophysiology, but are likely to significantly contribute to the disease burden in general in affected children.","","","cites as evidence","coci_wakefield_ret_intext_ref.csv"
