citfunc,sectitle,refentry,art,sectype,sectype2,refid,sec,ctx,pointerlist,nbcontexts,nbsections,itrp,anchorsent,partext,potential_cf,annotator,dataset
"cites as evidence","proximate event approach in assigning cause","","10.1002/9780470918449.biblio","","","","","","","","","","here is an example of proximate events leading to causation. a study published in 1998 by wakefi eld et al. showed a correlation between vaccination and autism and used this correlation to conclude causation (a. wakefi eld et al., “ ileal - lymphoid - nodular hyperplasia, non - specifi c colitis, and pervasive developmental disorder in children , ” the lancet 35 (1998): 637 – 641). the investigation of the 12 children with the symptoms of autism in this study led to the conclusion that the measles/mumps/rubella vaccine caused autism as well as the various bowel diseases often associated with autism.","","","cites as evidence","coci_wakefield_ret_intext_ref.csv"
"cites as evidence","on the role of the academic journal","","10.1287/isre.1110.0355","","","","","","","","","","by becoming part of the archival literature, publications find their place within an evolving body of inquiry: not necessarily always complete and correct, but the best possible at that date. note, in this regard, the wording of the lancet’s statement (2010) in response to their finding of misconduct in the wakefield et al. (1998) study linking vaccines to autism—“therefore we fully retract this paper from the published record.”","","","cites as evidence","coci_wakefield_ret_intext_ref.csv"
"disputes","media misinformation","","10.1097/01.npr.0000393970.21436.8b","","","","","","","","","","by 2003, thiomerosal was removed from all us vaccines, except influenza. after examining the results of more than 200 independent studies, in 2004, the institute of medicine formally rejected the autism vaccine link.7 it was also noted that symptoms usually appear around the same time that children receive the mmr vaccine and that any link is coincidental.7","","","disputes","coci_wakefield_ret_intext_ref.csv"
"cites for information","media misinformation","","10.1097/01.npr.0000393970.21436.8b","","","","","","","","","","in 2007, one actress and model stated her belief that childhood vaccinations may have contributed to her son’s autism.7 when asked about current research refuting any link between autism and vaccines, she said that her science was her son.7","","","cites for information","coci_wakefield_ret_intext_ref.csv"
"describes","history of the mmr controversy","","10.1007/s12124-011-9157-8","","","","","","","","","","in 1998, andrew wakefield and colleagues published a study in the prestigious medical journal the lancet in which they investigated the co-occurrence of bowel disease and developmental disorder in 12 children (wakefield et al. 1998). the authors noted that for eight of the 12 children studied, parents reported that behavioral symptoms of developmental disorder emerged shortly after mmr vaccination.","","","describes","coci_wakefield_ret_intext_ref.csv"
"disputes","discussion","","10.1111/j.1469-8749.2011.03915.x","","","","","","","","","","therefore, our conclusion from the current data is that broad gastrointestinal problems(rather than specific dietary concerns) reported by parents during early childhood are not associated with self-reportedalts in adulthood.wakefield et al.5 hypothesized that gastrointestinal prob-lems triggered by the mmr vaccine caused a ‘new variant’ ofasd that is characterized by developmental regression. how-ever, while epidemiological studies have consistently identified no association between the mmr vaccine and asd with or without developmental regression (for a review, see gerberand offit21) and the original publication has been retracted, public anxiety for the mmr vaccine remains.","","","disputes","coci_wakefield_ret_intext_ref.csv"
"critiques","background","","10.1186/1472-6963-11-60","related work","","","","","","","","","notwithstanding, there has been no evidence to support an association between an mmr vaccine and autism, nor is there a plausible biological mechanism [as reviewed by 29]. valuable time and resources were used to conduct as many as twenty studies to definitively respond to a study [30], whose arguments had many flaws that need not be explored here [29, 31, 32].
there has also been intense debate surrounding the evidence base and suitability of the variety of educational strategies and interventions that have been developed for individuals with autism [33–37].","","","critiques","coci_wakefield_ret_intext_ref.csv"
"discusses","","","10.1080/13698575.2010.515738","introduction","","","","","","","","","it is the science, he suggests, often in the form of epidemiology, that defines these risks, rendering them visible.
research in the uk on public understanding of risk factors for autism has frequently concentrated on the parental and public resistance to vaccination; specifically the measles, mumps, and rubella (mmr) vaccine after the much publicised report by wakefield et al. (1998) suggested a link between autism, crohn's disease, and the mmr vaccine. little work has been carried out on the public's conceptions of other risk factors, although some studies address parental understandings of asd aetiology.","","","discusses","coci_wakefield_ret_intext_ref.csv"
"disputes","environmental causes","","10.1097/gim.0b013e3181ff67ba","","","","","","","","","","although parental concern is still significant, multiple studies and lines of scientific evidence have identified no support for a relationship between immunizations and autism.18,185–188 the original studies by wakefield et al.189,190 suggesting an association between immunizations and autism have been disproved, the work was retracted by the lancet.191 in 2010 the british general medical council revoked mr. wakefield's license to practice medicine.","","","disputes","coci_wakefield_ret_intext_ref.csv"
"cites for information","discussion","","10.1097/inf.0b013e3181fbf5b7","","","","","","","","","","our results clearly demonstrate a vaccination gap between ms and oj school children in both completeness and timeliness of mmr vaccination, showing a delayed start and increased temporal spacing of childhood vaccinations. similar results for dtp vaccination suggest that this gap cannot be explained by fear for the mmr vaccine and its alleged link to autism.9 although we did not investigate the vaccination data for other vaccines, a similarly low vaccination coverage can be expected for other childhood vaccines, such as hepatitis b and meningococcal c vaccines.","","","cites for information","coci_wakefield_ret_intext_ref.csv"
"obtains background from","methodology","","10.1177/0907568210394879","methods","","","","","","","","","the study on which this article draws involved the secondary analysis of two qualitative data sets on professional and parental views of the mmr vaccination.3 these data sets were the outcome of studies carried out for the health education board for scotland in 1999 and 2001 in the context of growing concern about the impact on immunization take-up rates following the publication of a report in the lancet that highlighted a putative link between mmr, autism and inflammatory bowel disease (wakefield et al., 1998).4 the 1999 study included eight focus groups with parents, and the 2001 data set 11 such groups.5","","","obtains background from","coci_wakefield_ret_intext_ref.csv"
"disputes","natural history","","10.1002/9780470976739.ch26","","","","","","","","","","because this regression occurs at around the time of the measles, mumps and rubella (mmr) vaccine, some have attributed the regression to the vaccine. a study by wakefield et al. [34] identifying antigens to the mmr components in the intestines of individuals with asd heightened anxiety about this vaccine. the validity of wakefield’s study has been questioned [35, 36]; however, many families still believe that vaccines lead to autism","","","disputes","coci_wakefield_ret_intext_ref.csv"
"disputes","","","10.1007/s10803-011-1245-6","introduction","","","","","","","","","mercury (hg) has drawn particular attention as a risk factor (bernard et al. 2001), because of its known neurotoxicity (geier et al. 2008). thiomersal, an organo-mercury compound used as vaccine preservative until 2001 for its antiseptic and antifungal properties, was claimed as a causal agent responsible for “epidemic” of autism at the end of ‘90 s, in particular that used as a preservative of the measles-mumps-rubella vaccine (wakefield et al. 1998). however, subsequent epidemiological evaluations failed to support such results (freed et al. 2002; doja and roberts 2006; schechter and grether 2008).","","","disputes","coci_wakefield_ret_intext_ref.csv"
"discusses","","","10.1111/j.1468-3156.2010.00624.x","introduction","","","","","","","","","paradoxically though, environmental causes of autism accounted for 48%of newspaper coverage, yet formed only 7%of funded research, and 13%of published research. of the articles concerned with envi-ronmental issues, 70%focussed on the mmr vaccine, and its alleged link to the development of autism, and 40%referred to the study originally suggesting this association(wakefieldet al.1998). although this contrasts sharply to the focus autism research funding and scientific reporting, newspapers predominantly focussed on this causal link(which was later retracted by eleven of the original 13authors – see murchet al.2004), even though such stories were critical of the wakefieldet al.(1998) study.","","","discusses","coci_wakefield_ret_intext_ref.csv"
"discusses","","","10.1111/j.1468-3156.2010.00624.x","introduction","","","","","","","","","paradoxically though, environmentalcauses of autism accounted for 48%of newspaper coverage,yet formed only 7%of funded research, and 13%of published research. of the articles concerned with envi-ronmental issues, 70%focussed on the mmr vaccine, andits alleged link to the development of autism, and 40%referred to the study originally suggesting this association(wakefieldet al.1998) although this contrasts sharply tothe focus autism research funding and scientific reporting,newspapers predominantly focussed on this causal link(which was later retracted by eleven of the original 13authors – see murchet al.2004), even though such storieswere critical of the wakefieldet al.(1998) study.","","","discusses","coci_wakefield_ret_intext_ref.csv"
"discusses","","","10.1111/j.1468-3156.2010.00624.x","introduction","","","","","","","","","two of these studies(mason & donnelly 2000; speers & lewis 2004) indicate some association between the uk press’s framing of the safety of the mmr vaccine and falling uptake rates of this vaccine. however, although the smithet al.(2008) study also found an association between reduced mmr uptake rates in the united states and the publication of the wakefieldet al.(1998) study, this fall preceded media coverage of the controversy, thus suggesting the limited influence of media on people’s decisions about whether to vaccinate or not.","","","discusses","coci_wakefield_ret_intext_ref.csv"
"credits","discussion","","10.1111/j.2042-7166.2011.01092.x","","","","","","","","","","this suboptimal coverage questions whether the goal of measles elimination by 2010 could have been achieved.38 the low uptake of the vaccine is frequently related to the now discredited research linking autism to mmr vaccination.39 the present analysis suggests that it could also be due, in part, to the misinformation published by some cam practitioners.","","","credits","coci_wakefield_ret_intext_ref.csv"
"credits","the mmr vaccine controversy: an illustration of the cognitive polyphasia model","","10.1111/j.1468-5914.2011.00468.x","","","","","","","","","","this empirical example will be used to illustrate some of the propositions of the model discussed above.
the controversy over the measles, mumps and rubella (mmr) vaccine that started with the publication of a study led by dr andrew wakefield of the royal free hospital in london in february 1998 (wakefield et al., 1998) has had and continues to have a major impact in the united kingdom and abroad. by surmising a link between the vaccine and a form of autism, the debate shook the principle behind mass childhood immunisation, one of the most successful tools of modern medicine (bedford and elliman, 2000).","","","credits","coci_wakefield_ret_intext_ref.csv"
"credits","","","10.3109/1547691x.2011.580794","","","","","","","","","","notably, a longitudinal study done in japan over a 4-year period (1989–1993) demonstrated that the incidence of autism was not different across the interval before, during, and after this mmr vaccination window (uchiyama et al., 2007). 
the vaccine controversy arose from a single paper published in 1998 (wakefield et al., 1998), suggesting that the mmr vaccine was linked to autism. for parents with autistic children looking for a reason to explain their child’s diagnosis, this paper seemed a blessing and led to anti-vaccination cries from celebrities and advocacy groups.","","","credits","coci_wakefield_ret_intext_ref.csv"
"discusses","","","10.3109/1547691x.2011.580794","","","","","","","","","","for parents with autistic children looking for a reason to explain their child’s diagnosis, this paper seemed a blessing and led to anti-vaccination cries from celebrities and advocacy groups. the original wakefield et al. 1998 paper was fully retracted by the lancet on 2 feb 2010 following a report of the united kingdom’s general medical council. the british medical journal concluded that the study had been fraudulently concocted (godlee et al., 2011).","","","discusses","coci_wakefield_ret_intext_ref.csv"
"discusses","medicolegal aspects","","10.1002/9780470061589.fsa1025","methods","","","","","","","","","with this paper, and the label of a leading medical journal – the lancet – the controversy acquired the status of reliable scientific research. wakefield’ s theory was that live viruses administered together caused inflammatory bowel disease (ibd) in children, which gave rise to intestinal absorption disorders, which in turn led to neurological disorders, such as autism [20]. quite predictably, the report created considerable concern among parents, who began refusing mmr vaccination to their children.","","","discusses","coci_wakefield_ret_intext_ref.csv"
"discusses","","","10.1111/j.1754-4505.2011.00197.x","","","","","","","","","","on january 28, 2010, the british general medical council found that dr. andrew wakefield was guilty of four counts of dishonesty and 12 counts of abuse of developmentally disabled children.1 the journal, the lancet, retracted his 1998 paper “ileal‐lymphoid nodular hyperpla‐sia non‐specific colitis and pervasive developmental disorder in children,”2 which was authored by wakefield and 12 other physicians. this paper suggested that there was a causative connection between the measles, mumps, and rubella (mmr) vaccine and autism and autistic enterocolitis.","","","discusses","coci_wakefield_ret_intext_ref.csv"
"qualifies","why have people not been vaccinated?","","10.12968/pnur.2011.22.7.358","","","","","","","","","","this fear resulted from a paper published in the lancet in 1998, in which 8 out of 12 children with autism and bowel problems reported that their symptoms had started after they had received the mmr vaccine (wakefield et al, 1998). 
these findings were widely interpreted at the time as showing a link between the mmr vaccine, autism and bowel disease, and led to years of intense media coverage.","","","qualifies","coci_wakefield_ret_intext_ref.csv"
"credits","","","10.1258/ijsa.2009.009380","introduction","","","","","","","","","the key for success of any (new) vaccination is a high uptake, which can be hampered by the fear of adverse effects. for example, the vaccination coverage of the measles-mumps-rubella (mmr) vaccination decreased significantly, reaching dangerous levels, below 80% in some areas of scotland,12 in response to its hypothesized link to autism.13 similarly, the uptake of the recently introduced hpv vaccination (hpvv) in the dutch national immunization program, was unexpectedly low (60% as compared with the 80% hoped for) after reports in the press and popular media such as youtube spread misconceptions about adverse effects of the vaccination.","","","credits","coci_wakefield_ret_intext_ref.csv"
"credits","research supporting an autism–gi link ","","10.1586/egh.11.46","","","","","","","","","","specific studies are detailed in white’s review of intestinal pathophysiology in autism, and now these and a few selected others are briefly highlighted in chronological order. 
despite the controversial measles–autism link [76] by wakefield et al. that led to a prominent, public retraction of their lancet article [77], their group was the first to conduct ileocolonoscopies of children with ‘regressive developmental disorder’ with a history of intestinal symptoms (diarrhea, abdominal pain, bloating and food intolerance). all 12 children had intestinal abnormalities, ranging from lymphoid nodular hyperplasia to aphthoid ulceration.","","","credits","coci_wakefield_ret_intext_ref.csv"
"cites for information","discussion and hypothesis","","10.1201/b11019-27","","","","","","","","","","children with asd have been shown to have a significant increase in snps in this mthfr gene. it was reported that only 2% of autistic patients did not have at least one snp in their mthfr gene (boris et al. 2004). studies have shown abnormal absorption of vitamin b12 from the ileum of autistic children (wakefield et al. 1998). 
vitamin b12 deficiency is well known to have neuropsychiatric consequences in adults (zucker et al. 1981) and adversely affects neurodevelopment during infancy (graham, arvela, and wise 1992).","","","cites for information","coci_wakefield_ret_intext_ref.csv"
"disputes","discussion","","10.1371/journal.pone.0022737","","","","","","","","","","furthermore, although it is true that a number of published studies have implicated vaccines in certain disorders, these have generally not held up under investigative scrutiny. for example, an oft quoted 1998 study of 12 children by wakefield et al. suggested a link between mmr vaccination and the development of autism [27].what anti vaccinationists may fail to note is that larger trials failed to confirm these findings [28]–[30], and that wakefield was subsequently found to have falsified his data [31] leading the lancet to retract his publication in 2010 [32].","","","disputes","coci_wakefield_ret_intext_ref.csv"
"cites as evidence","","","10.1007/s00256-011-1224-1","","","","","","","","","","recently, conflict-of-interest issues and the related issues of scientific misconduct from a variety of medical disciplines have increasingly been reported in the lay press. for example, lancet was forced to retract an article it had published that linked measles, mumps, and rubella vaccinations to autism after it was learned that the author and his research had been sponsored by a law firm engaged in litigation on this subject [6, 7, 8]. in 2009, an article published in the journal of bone and joint surgery reporting on the use of recombinant dna to promote the healing of bone grafts was retracted after a number of authors realized that their signatures had been forged on the original submission, and reported that some of the data included in the study had been fabricated [9, 10].","","","cites as evidence","coci_wakefield_ret_intext_ref.csv"
"discusses","the social contexts of vaccines: understanding receptivity and resistance ","","10.1089/omi.2010.0139","","","","","","","","","","in this case, reticence in getting inoculated can be based on low perceptions of risk in the context of an unfamiliar infectious disease (poland, 2010), the uncertainties around a new and an unfamiliar vaccine, mistrust of information provided by health authorities (poland, 2010), and concerns about pharmaceuticals being rushed to market in a health crisis (henrich and holmes, 2009; quinn et al., 2009). 
a recent high-profile controversy lasting over a decade revolved around the mmr vaccine, which began with a publication—since retracted—proposing a link between the vaccine and autism (wakefield et al., 1998). the ensuing intense media coverage and on-going efforts by opposition groups saw a sufficient drop in compliance rates in the united kingdom and higher incidence rates of these three childhood diseases (mcintyre and leask, 2008).","","","discusses","coci_wakefield_ret_intext_ref.csv"
"critiques","background","","10.1002/14651858.cd007849.pub2","related work","","","","","","","","","environmental factors such as toxic exposures, teratogens, perinatal insults and prenatal infections including rubella and cytomegalovirus, also contribute to a small proportion of cases (muhle 2004). asd was once also linked to mmr vaccination (wakefield 1998), but the original evidence was later found to be fraudulent (godlee 2011) and other epidemiological studies refuted the link (madsen 2002; taylor 2002). it is suggested that asd might result from an interaction between genetic, environmental and immunological factors, with oxidative stress as a mechanism linking these risk factors (chauhan 2006).","","","critiques","coci_wakefield_ret_intext_ref.csv"
"discusses","","","10.1345/aph.1q318","introduction","","","","","","","","","the wakefield autism paper gained scientific legitimacy when published in the prestigious and widely read medical journal the lancet in 1998.. in 2000, wakefield published another article claiming that the measles, mumps, and rubella (mmr) vaccine was introduced into mass vaccination programs without sufficient safety testing.'","","","discusses","coci_wakefield_ret_intext_ref.csv"
"disputes","","","10.5765/jkacap.2011.22.3.141","introduction","","","","","","","","","the cause of regression is not well known to date; studies have reported the association between regression and epilepsy, 10 but no other studies have demonstrated the relationship between the two.6,11) regression in children with asd previous studies have reported that this measles-mumps-rubella (mmr) vaccine has been associated with it.12 subsequent studies have reported no association between mmr vaccine and degeneration in children with asd.13","","","disputes","coci_wakefield_ret_intext_ref.csv"
"cites as evidence","","","10.1080/17449642.2011.632716","","","","","","","","","","now some have also argued against oa by pointing out that some sensitive research material could pose a risk to the public. controversial cases, such as the alleged link between mmr vaccines and autism, have been used as examples (wakefield et al. 1998). we would argue that limiting access on the basis of financial resources is not an ethical but rather an expedient way to protect public interest.","","","cites as evidence","coci_wakefield_ret_intext_ref.csv"
"discusses","","","10.1080/17449642.2011.632716","","","","","","","","","","we would argue that limiting access on the basis of financial resources is not an ethical but rather an expedient way to protect public interest. the public, in turn, benefits from being able to judge the evidence for themselves by reading both the original wakefield et al. (1998) article and the evidence of fraud (deer 2011). however, we are willing to concede that those who seriously believe that their research would cause harm if released to the public are exempt from any moral obligation to distribute their work widely.","","","discusses","coci_wakefield_ret_intext_ref.csv"
"critiques","","","10.1080/07370016.2011.615178","introduction","","","","","","","","","recent developments, however, have led many parents to question the standard immunization regimen. reports such as that of wakefield et al. (1998), which proposed linkages between the measles, mumps, and rubella (mmr) vaccine and acquired developmental disorders in children, have contributed to public scrutiny of common immunizations. the realization that the research upon which these assertions were made was based upon faulty methodologies, has since led to retraction of the original research (bosely, 2010).","","","critiques","coci_wakefield_ret_intext_ref.csv"
"disputes","oxidative stress ","","10.3109/1354750x.2011.598564","","","","","","","","","","impaired vitamin b12 metabolism can lead to accumulation of methylmalonic acid in tissues and body fluids. a study by wakefield et al. (1998) describing ileal lymphoid hyperplasia in children with asd (but retracted 2nd feb 2010, lancet) reported that urinary methylmalonic acid levels were significantly higher in children with asd (n = 8) compared to age and gender matched normal controls (n = 14). however, there have been no other studies to confirm these results to date.","","","disputes","coci_wakefield_ret_intext_ref.csv"
"discusses","case study: mmr vaccine","","10.1098/rsta.2011.0123","","","","","","","","","","it was clear that the general public and many clinicians had forgotten the unpleasant, although rare, serious morbidity and mortality associated with measles.
in 1998, andrew wakefield et al. reported in the lancet a study of 12 children that claimed that nine children displayed autistic symptoms and that for eight of these children a link could be shown to the mmr vaccine [8]. successive negative media reporting reduced the confidence of parents and the public in the mmr vaccine, such that in early 2003 over 35 per cent of mothers were not confident in mmr safety and the uptake had fallen to only 65 per cent of infants.","","","discusses","coci_wakefield_ret_intext_ref.csv"
