citfunc,sectitle,refentry,art,sectype,sectype2,refid,sec,ctx,pointerlist,nbcontexts,nbsections,itrp,anchorsent,partext,potential_cf,annotator,dataset
"discusses","","","10.1002/jppr1998286443","","","","","","","","","","the suggestion that measles infection is causally linked to crohn's disease had been disproved already6 but there has since been a decrease in mmr vaccination uptake with the potential for future morbidity. 7 the basis for the early report was 12 children whose parents had reported the onset of bowel disease and autism soon after mmr vaccination. 5the age when these conditions first appear however, is also the age for mmr vaccination.","","","discusses","coci_wakefield_ret_intext_ref.csv"
"disputes","","","10.1002/jppr1998286443","","","","","","","","","","the publication of the 'early report' based on only 12 patients resulted in a prodigious correspondence which canvassed the rift which can exist between clinical medicine and public health, 12 and the inadequacy of evidence related to problems of methodology. 11-21 the controversy in that correspondence was whether or not the paper bywakefield5 should have been accepted for publication. it attracted mass media attention and generated considerable public concern despite the lack of evidence linking mmr vaccination with the conditions suffered by the 12 children.","","","disputes","coci_wakefield_ret_intext_ref.csv"
"discusses","discussion","","10.1177/1362361398024006","","","","","","","","","","the factors that were revealed, however, indicate the need for further investigation into the possible links between the autistic syndrome and the prevalence of physiological factors.
speculation about a possible interplay between autism and various biochemical systems of the body, such as the immune system (warren et al., 1996; van gent et al., 1997; wakeﬁeld et al., 1998), suggests that speciﬁc behaviours associated with the autistic syndrome could also be accompanied by speciﬁc physiological problems associated with affected
systems of the body. the ﬁndings that nearly two-thirds of children
showed a history of eczema or similar skin complaints, and over a quarter
had problems with asthma—related conditions (both exceeding the general
population incidence ﬁgures), imply the involvement of the immune
system in some fashion.","","","discusses","coci_wakefield_ret_intext_ref.csv"
"cites as evidence","discussion","","10.1177/1362361398024006","","","","","","","","","","the incidence of migraines is compatible with the phenyls ulphotransferase enzyme deﬁciency hypothesis (waring et al.,1996), which has also been associated with subsequent physiological difﬁculties such as problems with intestinal permeability (waring and
ngong, 1993; shattock and savery, 1996). the signiﬁcance of a link between parental and sibling health problems (especially related to problems of the immune system) and the presence of physiological symptoms coexisting with the overt diagnostic deﬁnition of autism
supports the view of autism being an organic disorder, either immunological or metabolic (shattock and savery, 1996 ; wakeﬁeld et al., 1998), with a genetic basis at least, in a subgroup of children.","","","cites as evidence","coci_wakefield_ret_intext_ref.csv"
"qualifies","","","10.1177/1362361398024007","","","","","","","","","","a recent report in the lancet about a possible connection between measles—
mumps—rubella immunization (mmr) and autism (wakeﬁeld et al., 1998)
has received a lot of attention in the media. if mmr is indeed an important
cause or trigger of late onset autism, then this would have enormous
consequences given that millions of children receive this vaccination every
year.","","","qualifies","coci_wakefield_ret_intext_ref.csv"
"describes","discussion","","10.1177/1362361399003001005","introduction","","","","","","","","","the ‘opioid-excess’ theory of autism (panksepp, 1979; reichelt et al., 1981; 1993; 1994; shattock et al., 1990; wakefield et al., 1998) suggests that autism is the consequence of the action of peptides1 of exogenous origin affecting neurotransmission within the central nervous system (cns). peptides,2 formed through the incomplete breakdown of foods2 containing gluten (found in cereal produce) and casein (derived from dairy produce), exhibit direct opioid activity or form ligands for the peptidase enzymes which break down endogenous endorphins and enkephalins.","","","describes","coci_wakefield_ret_intext_ref.csv"
"cites for information","discussion","","10.1177/1362361399003001005","introduction","","","","","","","","","peptides,2 formed through the incomplete breakdown of foods2 containing gluten (found in cereal produce) and casein (derived from dairy produce), exhibit direct opioid activity or form ligands for the peptidase enzymes which break down endogenous endorphins and enkephalins. the passage of elevated levels of peptides through to the cns is further aided by gastrointestinal conditions indicative of an abnormally porous intestinal membrane (waring and ngong, 1993; gardner, 1994; d’eufemia et al., 1996; wakefield et al., 1998). the resultant presence of intensified opioid activity disrupts a variety of systems within the cns.","","","cites for information","coci_wakefield_ret_intext_ref.csv"
"qualifies","discussion","","10.1177/1362361399003001005","introduction","","","","","","","","","problems with intestinal permeability have been found in a proportion of children with autism (d’eufemia et al., 1996). similarly, the gastrointestinal findings following measles-mumps-rubella immunization (mmr) reported by wakefield et al. (1998) suggest impaired intestinal function and increased permeability. the increased levels of iag3 and other, as yet unidentified, compounds found in the urine of people with tenuous autism also provides support for the existence of an abnormally porous intestinal membrane.","","","qualifies","coci_wakefield_ret_intext_ref.csv"
"credits","genetic findings","","10.1097/00019052-199904000-00005","","","","","","","","","","it appears likely that rather than playing an aetiological role, the obstetric and neurological adversities represent an epiphenomenon of the condition or derive from some shared risk factor[33]. considerable media attention in the uk accompanied the publication of a series of case studies [34] that documented intestinal abnormalities and reported histories of loss of skills (including in some cases an autistic-like presentation), which in several but not all cases closely followed vaccination for measles, mumps and rubella (mmr). although the authors themselves presented any possible association as merely a hypothesis that awaited confirmation, the article was interpreted by the media as suggesting a causal link between the mmr and autistic regression.","","","credits","coci_wakefield_ret_intext_ref.csv"
"disputes","vaccine-phobia","","10.1177/001857879903400610","","","","","","","","","","later, more detailed analyses showed that whole-cell pertussis vaccine is temporally associated with acute encephalopathy, but there is no evidence of an association with lasting neurologic damage.8,12,17–18 
more recently, measlesmumps-rubella (mmr) vaccine was portrayed as associated with inflammatory bowel disease, crohn’s disease, and autism in news reports, triggered by articles in british journals in 1997 and early 1998.19–21 multiple subsequent analyses pointed out the logical and biological flaws in these assertions and failed to find any such association.5–6,16,22–26","","","disputes","coci_wakefield_ret_intext_ref.csv"
"qualifies","epidemiologic aspects","","10.1097/00001574-199907000-00008","","","","","","","","","","generally, it seems that the incidence of uc has changed little over the past decade.

another recent paper by wakefield et al.[5], implicating a close relationship between the measles, mumps, and rubella (mmr) vaccine, ibd, and autism in children, stimulated much controversy. in a relatively small number of patients (12), an association was found between pervasive developmental disorders and ileal-lymphoid-nodular hyperplasia or nonspecific colitis.","","","qualifies","coci_wakefield_ret_intext_ref.csv"
"cites for information","discussion","","10.1097/00005176-199909000-00008","","","","","","","","","","this is a reasonable conclusion, because after casein is ingested, many casein-derived peptides can be recovered from the blood (7). ileal-lymphoid nodular hyperplasia and nonspecific colitis have been related to late-onset pervasive development in children (17). in this group of children, we find very high peptide levels in the urine (14,15).","","","cites for information","coci_wakefield_ret_intext_ref.csv"
"cites for information","autism with intestinal features 
","","10.1089/acm.1999.5.575","introduction","","","","","","","","","some researchers regard the presence of abdominal features in these illnesses as important and of possible etiologic significance (amery and forget, 1989; mavromichalis et al., 1995; peppercorn and herzog, 1989). recently, autism has been added to the list of neurologic conditions with abdominal features (horvath et al., 1998; murch et al, 1998; wakefield et al., 1998;). 
a possible explanation of the relationship between abdominal symptoms and neurological syndromes can be found in the influence that the enteric nervous system (ens) has on the central nervous system (cns).","","","cites for information","coci_wakefield_ret_intext_ref.csv"
"discusses","autism with intestinal features 
","","10.1089/acm.1999.5.575","introduction","","","","","","","","","although there is no cure, appropriate management may foster relatively normal development and reduce undesirable behaviors, 
recent medical research may add autism to the growing list of neurological illnesses with abdominal features. wakefield et al. (1998) investigated a consecutive series of children with chronic enterocolitis and regressive developmental disorder. the 12 children (mean age 6 years) had a history of normal development followed by loss of acquired skills, including ianguage.","","","discusses","coci_wakefield_ret_intext_ref.csv"
"qualifies","aetiology","","10.1192/bjp.176.1.20","","","","","","","","","","more tangible has been the discovery of lymphoid hyperplasia near the ileo-caecal junction in children who had been selected on the basis of an autistic regression together with current bowel symptoms (wakefield et al, 1998c ). the regression occurred immediately after immunisation in only one-third of the subjects, but nearly all the biopsy specimens showed evidence of measles infection (wakefield et al, 1998a ). this suggests that measles might act in conjunction with another factor, whether genetic predisposition, intercurrent infection or multiple immunisation, to trigger a chronic inflammatory response.","","","qualifies","coci_wakefield_ret_intext_ref.csv"
"cites for information","","","10.1080/13590840020013248","","","","","","","","","","since many of the uk children were experiencing diarrhoea and other gastrointestinal problems, dr andrew wake􏱜field, a gastroenterologist at the royal free hospital, was consulted. 
the ensuing battle, conducted in the pages of the lancet in articles, editorials and letters [8, 9, 10] would, if reported in detail, take more space than can possibly be devoted to it here, and is probably well known to the reader. suf􏱜r ce it to say that the acrimonious charges and countercharges are still being heard, and the 􏱜 ght is far from over.","","","cites for information","coci_wakefield_ret_intext_ref.csv"
"disputes","discussion","","10.1080/13590840020013257","","","","","","","","","","it is possible that other metals may play an etiologic role in some cases in a similar manner [16– 18]. there is now evidence that some of these children have had their bowel/brain disease triggered by immunizing agents [19], though this has been refuted [20]. also, ileal-lymphoid nodular hyperplasia has been reported in other conditions [21].","","","disputes","coci_wakefield_ret_intext_ref.csv"
"cites for information","","","10.1080/13590840020024994","","","","","","","","","","the number of children involved in it has now grown to over 1,000, and it should come to court early next year. meanwhile dr andrew wake􏱜field, with his new collaborator, prof. john o’leary of dublin, hopes next year to publish new research which, they claim, con􏱜firms in greater detail the hypothesis set out in the 1988 lancet paper [6]. but how does this mesh with the new, mercury-based, hypothesis of autism?","","","cites for information","coci_wakefield_ret_intext_ref.csv"
"discusses","aetiology ","","10.1007/s007870070022","","","","","","","","","","recently, attention has been drawn to a report on a consecutive series of 12 children with a history of pervasive developmental disorder who were reported to exhibit loss of acquired skills and intestinal symptoms, such as diarrhoea, abdominal pain and food intolerance. extensive clinical investigations revealed a chronic inflammatory bowel disease, associated autism (n = 9) or related conditions (n = 3) and an absence of focal neurological abnormalities (124). according to the parents, the onset of behavioural symptoms was associated with recent measles, mumps, rubella vaccination in eight children, with measles infection in one child and with otitis media in another child.","","","discusses","coci_wakefield_ret_intext_ref.csv"
"cites for information","","","10.1177/1362361300004002008","","","","","","","","","","the original theory of elevated levels of opioid-type compounds affecting neurotransmission within the central nervous system (cns) of people with autism has been expanded (shattock et al., 1990; shattock and savery, 1996; wakefield et al., 1998) and biochemical tests are now available to establish the presence of these compounds in the urine of people with autistic spectrum disorders (reichel et al., 1981; shattock et al., 1990; mills et al., 1998). diet has long been suspected of being the source of these exogenously derived opioid-type compounds, with studies demonstrating a connection between the exclusion of gluten and/or casein from the diet and improvements in the behaviour of some children with autism (knivsberg et al., 1990; 1995; lucarelli et al., 1995; whiteley et al., 1999).","","","cites for information","coci_wakefield_ret_intext_ref.csv"
"qualifies","discussion","","10.1177/088307380001500701","","","","","","","","","","the apparent, though short-term, improvement during treatment with this minimally absorbed antibiotic is not explainable using current conventional genetic hypotheses 17 alone for autism. results of this preliminary study, along with previous reports of increased intestinal permeability18 and a &dquo;nonspecific colitis&dquo; in children with autism 19,&dquo; suggests a possible &dquo;gut-brain&dquo; etiologic connection in a subset of these children. although the hypothesis that autism (in a defined subset of children) might be a sequela to the colonization of the intestinal tract by one or more neuro toxin-producing bac-teria is novel, published data along several paths could lend credence to the notion that an alteration in colonic flora contributes to autism symptoms.","","","qualifies","coci_wakefield_ret_intext_ref.csv"
"credits","","","10.1111/j.1572-0241.2000.03247.x","","","","","","","","","","others have emphasized the possible impact of a number of postnatal factors ranging from environmental toxins to dietary factors, and a variety of infectious agents. of these, the possible relationship to casein and gluten intolerance (5), on one hand, and measles and mmr vaccination (6), on the other, have generated particular interest. as a consequence of the former, many of these children, who often already have a very limited diet because of highly selective eating patterns, are placed on casein and glutenfree diets, rendering an already precarious dietary intake even more so.","","","credits","coci_wakefield_ret_intext_ref.csv"
"describes","","","10.1111/j.1572-0241.2000.03247.x","","","","","","","","","","however, it is the possible association of autism with ileocolonic disease that has attracted the most attention. wakefield et al. first reported prominent ileal lymphoid nodular hyperplasia (lnh) and ileocolitis in an uncontrolled study of 12 autistic children and went on to speculate a link to mmr vaccination (6). the same group had previously postulated a similar link between measles, mmr, and inflammatory bowel disease in adults (11, 12).","","","describes","coci_wakefield_ret_intext_ref.csv"
"uses data from","discussion","","10.1111/j.1572-0241.2000.03248.x","results","","","","","","","","","we have recently described a characteristic pattern of intestinal inflammation in a cohort of children with developmental disorders (1). in these children, the majority of whom had autism, a period of initial normal development was followed by developmental regression and loss of acquired skills, sometimes occurring precipitously over a period of days to weeks.","","","uses data from","coci_wakefield_ret_intext_ref.csv"
"discusses","discussion","","10.1111/j.1572-0241.2000.03248.x","results","","","","","","","","","in these children, the majority of whom had autism, a period of initial normal development was followed by developmental regression and loss of acquired skills, sometimes occurring precipitously over a period of days to weeks. long-standing intestinal symptoms, as described previously (1), were typical of this group of children. these symptoms had often started at around the same time as the behavioral changes.","","","discusses","coci_wakefield_ret_intext_ref.csv"
"cites for information","discussion","","10.1111/j.1572-0241.2000.03248.x","results","","","","","","","","","in its persistent acquired form, ileal lnh has been reported in association with infection with human immunodeficiency virus (hiv) before the development of aids (10). 
the other consistent feature of the intestinal lesion was a mild-to-moderate colitis that lacked the specific diagnostic features of either crohn’s disease or ulcerative colitis (1). this combination of features, i.e., lnh and nonspecific colitis, indicates the possibility of chronic mucosal and/or systemic immune dysregulation.","","","cites for information","coci_wakefield_ret_intext_ref.csv"
"obtains background from","discussion","","10.1111/j.1572-0241.2000.03248.x","results","","","","","","","","","these immune changes, plus the presence of myelin basic protein (mbp) antibodies (15) and inhibition of macrophage migration to mbp (16), have led some workers to suggest that the behavioural syndrome may be associated with cerebral damage due to an autoimmune response to myelin or other structural components of the cns (15, 16). as part of our initial study (1) we undertook cerebral magnetic resonance imaging, eeg, and biochemical analysis of cerebrospinal fluid; none of these investigations indicated cerebral inflammation that would be consistent with autoimmune demyelination, although a more subtle lesion remains a possibility. alternatively, others have proposed that some forms of autism may arise from the toxic effects of intestinal products on the developing brain (17–19), a situation that may have some overlap with hepatic enephalopathy.","","","obtains background from","coci_wakefield_ret_intext_ref.csv"
"uses data from","discussion","","10.1111/j.1572-0241.2000.03248.x","results","","","","","","","","","this study involved the analysis of data from 60 consecutive children with developmental disorders (affected children) including those 12 children described in a preliminary report (1). the median age of the children was 6 yr (range 3–16 yr) and 53 were boys, consistent with the male bias of developmental disorders (20).","","","uses data from","coci_wakefield_ret_intext_ref.csv"
"cites for information","discussion","","10.1111/j.1572-0241.2000.03248.x","results","","","","","","","","","all clinical investigations were undertaken with fully informed, written consent from the parents. the initial phase of these studies (1) was approved by the ethical practices committee of the royal free hampstead nhs trust. thereafter, children were investigated according to clinical need after a formal referral from each child’s general practitioner or consultant.","","","cites for information","coci_wakefield_ret_intext_ref.csv"
"obtains support from","discussion","","10.1111/j.1572-0241.2000.03248.x","results","","","","","","","","","lnh (not graded), red halo sign surrounding follicles (21), loss of vascular pattern, mucosal granularity, mucosal erythema, and presence of ulcer(s). these features, which are recognized correlates of associated histopathological abnormality, were noted previously to be characteristic of this patient group (1). these features were recorded both for cases and for non-ibd controls; the data are shown in figure 3.","","","obtains support from","coci_wakefield_ret_intext_ref.csv"
"obtains support from","discussion","","10.1111/j.1572-0241.2000.03248.x","results","","","","","","","","","the differences between biopsies from affected children and from both non-ibd controls and those with ulcerative colitis are significant (p 􏰌 0.001 and p 􏰌 0.01, respectively). qualitatively, ileal lymph nodes in those children with lnh showed marked expansion of lymphoid tissue in histological section, as described previously (1). follicle numbers per biopsy were increased from 2–3 follicles per biopsy in normal ileal biopsies to 4–5 per biopsy in those with lnh: follicles were confluent with loss of follicle-to-follicle demarcation.","","","obtains support from","coci_wakefield_ret_intext_ref.csv"
"extends","discussion","","10.1111/j.1572-0241.2000.03248.x","results","","","","","","","","","these data both confirm and extend our original observations (1), and indicate a subtle and consistent pattern of intestinal pathology in this cohort of consecutively referred children. the combination of ileocolonic lnh and colitis in children with developmental disorders distinguished them from developmentally normal children with similar symptoms (including abdominal pain and constipation) in whom lnh and histopathological change were uncommon.","","","extends","coci_wakefield_ret_intext_ref.csv"
"credits","using the steps","","10.1177/001857870003501217","","","","","","","","","","wakefield and colleagues raised concerns about mmr vaccine leading to inflammatory bowel disease (ibd, eg, ulcerative colitis, crohn’s disease).41 wakefield’s theory is based on 12 people referred to a specialty service, even though no vaccine viruses were isolated from these patients.","","","credits","coci_wakefield_ret_intext_ref.csv"
"disputes","using the steps","","10.1177/001857870003501217","","","","","","","","","","this is the time when mmr vaccine is administered. the other “evidence” offered for an association between mmr and autism is wakefield’s inference that bowel problems could lead to decreased absorption of nutrients, permitting developmental disorders like autism.41 this case against mmr is based on speculation and events coinciding in time, no more.51,55–56","","","disputes","coci_wakefield_ret_intext_ref.csv"
"disputes","discussion","","10.1097/00006454-200012000-00002","","","","","","","","","","no case of inflammatory bowel disease or autism was detected during this long follow-up study comprising 3 million vaccine doses. this finding is important because were there an association with mmr vaccination after such a short interval as suggested, 45, 46 this prospective study design would undoubtedly have disclosed at least some cases.
some events were no doubt triggered by mmr vaccination.","","","disputes","coci_wakefield_ret_intext_ref.csv"
"disputes","pathologies of “bonding”—the case of autism","","10.1002/1097-0355(200101/04)22:1<132::aid-imhj5>3.0.co;2-9","","","","","","","","","","indeed,the increasing incidence of autism during the last few decades may implicate environmental vectors (rimland, 1999). among those being most actively considered besides dietary factors (shattock & lowdon, 1991; whiteley, 1999), are rare autoimmune disorders that may arise from viruses (singh, warren, averett, & ghaziuddin, 1997; singh, lin, & yang, 1998) or perhaps even a hyperresponsiveness to early inoculations with certain vaccines (wakefield et al., 1998), although no convincing epidemiological data on that issue has ever been published. of course, with the overall low incidence of such iatrogenic problems, it will be difficult to verify the role of specific vectors in rigorous ways (fombonne, 1999).","","","disputes","coci_wakefield_ret_intext_ref.csv"
"obtains support from","discussion","","10.1080/1028415x.2001.11747348","","","","","","","","","","furthermore peptides can cross the blood-brain barrier (nyberg et al., 1989; banks and kastin, 1990; ermisch et al., 1993). a rather strong indication of this gut/brain connection is the regional nodular lymphadenitis reported in late onset autism (wakefield et al., 1998). 
transmitter abnormalities have been detected in autism, where one of the more robust findings is increased uptake of serotonin in blood platelets (i.e., review in gillberg and coleman, 1992), and two serotonin uptake stimulators have 
identified (reichelt et al., 1994; 1998).","","","obtains support from","coci_wakefield_ret_intext_ref.csv"
