citfunc,sectitle,refentry,art,sectype,sectype2,refid,sec,ctx,pointerlist,nbcontexts,nbsections,itrp,anchorsent,partext,potential_cf,annotator,dataset
"cites as evidence","the question addressed and the answers provided","","10.1111/j.1365-2044.2005.04151.x","","","","","","","","","","certain topics are guaranteed to catch the eye more than others, and this can sometimes lead to the overriding of proper scientific considerations before publication by a journal. a recent example is the publication of wakefield's [49] much‐criticised study of the link between autism and vaccination (a highly topical issue) in the lancet (a high impact factor journal – see below), and then the subsequent retraction of this paper [50].
in the wider scientific community, a very general rank order of the ‘importance’ of studies appears to have evolved, dependent in part upon the type of question addressed.","","","cites as evidence","coci_wakefield_ret_intext_ref.csv"
"discusses","","","10.1177/0038038505050536","related work","","","","","","","","","in 1998, the lancet published a report that established a putative link between the mmr vaccine and the development of crohn’s disease and autism (wakefield et al., 1998).1 following this, hebs commissioned research to focus specifically on professional and parental attitudes towards mmr and immunization generally in three health board areas.","","","discusses","coci_wakefield_ret_intext_ref.csv"
"credits","","","10.1164/rccm.2501005","","","","","","","","","","the report of this visit was highly critical of the original experiments (13), and the matter ended with accusations of mccarthyite persecution and witch hunting comparable to salem. the massive public concern surrounding the mmr vaccine, and subsequent catastrophic drop in immunization rates in the united kingdom after the publication of a single paper (14) (the interpretation of which has now been formally refuted by several of the original authors [15] and repudiated by the editor of the journal in which it was published), could possibly have been prevented altogether by such an approach. it is unlikely to be necessary in the majority of cases, in which the work submitted will have little immediate impact.","","","credits","coci_wakefield_ret_intext_ref.csv"
"qualifies","","","10.1068/a3779","introduction","","","","","","","","","in the united kingdom the duties of citizenship have been challenged in relation to mmr, with controversy stemming from divergent views about the relative risks of the diseases compared with the side effects of the vaccine. the controversy was sparked by media reporting of a preliminary study (wakefield et al, 1998) of twelve children with a history of normal development followed by loss of acquired skills. the study linked mmr with neither autism nor crohn's disease, but in stressing the need for further investigations potentially inferred that health links may be proven.","","","qualifies","coci_wakefield_ret_intext_ref.csv"
"discusses","the rise and fall of a risk hypothesis","","10.1377/hlthaff.24.3.729","","","","","","","","","","on 28 february 1998, the british medical journal lancet published an account of an investigation of the link between chronic gastrointestinal disease and severe developmental regression in children. the research team at london’s royal free hospital was careful to note in its report that although in “most cases, onset of symptoms was after measles, mumps and rubella immunization,” they had not proved a causal link. 15 but this cautious wording was belied by the press conference the hospital called to publicize the findings.","","","discusses","coci_wakefield_ret_intext_ref.csv"
"discusses","","","10.1377/hlthaff.24.3.740","introduction","","","","","","","","","in their case, the spotlight was turned on the measles-mumps-rubella (mmr) vaccine. 1 the source of public unrest was a 1998 study published in the journal lancet that hinted that the vaccine might account for some of the troubling increase in autism cases in the united kingdom and, by implication, elsewhere, including the united states. 2 the ostensible villain of the piece was the measles component of the combination vaccine. 3","","","discusses","coci_wakefield_ret_intext_ref.csv"
"qualifies","","","10.1179/146531205225020925","","","","","","","","","","well, let’s come to that in a moment, but it would be helpful to provide some perspective and give some examples first. some classics spring to mind such as (in medicine): ileal-lymphoid-nodular hyperplasia, non-specific colitis and pervasive developmental disorder in children, wakefield et al.1—the paper that did it for the mmr vaccine and put andrew wakefield on the map; in dentistry and orthodontics we could consider studies that have influenced our assumptions about positions of tooth stability; whether functional appliances grow mandibles and studies which have influenced our knowledge, understanding and management of tmd to name but a few topics. is all this work, which has fundamentally affected what we do to patients, served us (or them) in good stead?","","","qualifies","coci_wakefield_ret_intext_ref.csv"
"credits","the mmr crisis","","10.1108/14777260510608970","introduction","","","","","","","","","since the publication of andrew wakefield's research into a form of bowel disease and autism in children and a possible link with the mmr vaccine (wakefield et al., 1998), rates of immunisation with mmr have fallen dramatically. there has been much debate, and some research into possible reasons.","","","credits","coci_wakefield_ret_intext_ref.csv"
"discusses","the mmr crisis","","10.1108/14777260510608970","introduction","","","","","","","","","in 1998, a rather esoteric paper entitled “ileal lymphoid‐nodular hyperplasia, non‐specific colitis, and pervasive developmental disorder in children” was published in the lancet (wakefield et al., 1998). the story of why this obscurely titled paper led to a moral panic and a falling rate of mmr vaccination in children is of interest for precisely that reason – why are some issues (that seem to come from nowhere) taken up whilst others are not?","","","discusses","coci_wakefield_ret_intext_ref.csv"
"cites for information","","","10.1089/vim.2005.18.307","introduction","","","","","","","","","in this review, we will focus on the current concerns that have surfaced regarding a possible association between autism and childhood vaccination. one theory suggests that the mmr vaccine may precipitate autism in a subpopulation of vaccinated children (47). the second theory proposes that the mercury-containing preservative, thimerosal, is a vaccine additive that may act as an environmental trigger for the development of autism (22).","","","cites for information","coci_wakefield_ret_intext_ref.csv"
"qualifies","","","10.1089/vim.2005.18.307","introduction","","","","","","","","","unfortunately, the fear of contracting these childhood diseases has been displaced by fears of the mmr vaccine itself. one anecdotal study, based on 12 children with autistic spectrum disorders, has triggered widespread fear and concern over the safety of the mmr vaccine because it questioned whether the vaccine was linked to increased rates of autism in immunized children (47). since its publication in 1998 (47) and widespread media coverage (32), mmr vaccine coverage in the u.k. declined from 91% in 1997 (14) to 82% in 2004 (13), with vaccine coverage as low as 60% in some regions (53).","","","qualifies","coci_wakefield_ret_intext_ref.csv"
"credits","","","10.1089/vim.2005.18.307","introduction","","","","","","","","","one anecdotal study, based on 12 children with autistic spectrum disorders, has triggered widespread fear and concern over the safety of the mmr vaccine because it questioned whether the vaccine was linked to increased rates of autism in immunized children (47). since its publication in 1998 (47) and widespread media coverage (32), mmr vaccine coverage in the u.k. declined from 91% in 1997 (14) to 82% in 2004 (13), with vaccine coverage as low as 60% in some regions (53).","","","credits","coci_wakefield_ret_intext_ref.csv"
"disputes","","","10.1089/vim.2005.18.307","introduction","","","","","","","","","together, these two large epidemiological studies indicate that the mortality rate after mmr vaccination is less than one death per 3.5 million vaccinations, clearly demonstrating the safety of this vaccine over the potentially lethal consequences of contracting natural measles, mumps, or rubella (fig. 2). 
despite an exceptionally strong safety record, the use of mmr vaccination came under intense scrutiny after a clinical study published by wakefield et al. in 1998 (47). these investigators described a chronic enterocolitis in 12 children with autism or other pervasive developmental disorders (pdd) (47).","","","disputes","coci_wakefield_ret_intext_ref.csv"
"discusses","","","10.1089/vim.2005.18.307","introduction","","","","","","","","","despite an exceptionally strong safety record, the use of mmr vaccination came under intense scrutiny after a clinical study published by wakefield et al. in 1998 (47). these investigators described a chronic enterocolitis in 12 children with autism or other pervasive developmental disorders (pdd) (47). the authors suggested that the developmental disorders seen in these children might be related to enterocolitis and further suggested that because the parents or the children’s primary physicians temporally associated administration of the mmr vaccine with the onset of developmental problems, it was plausible that the mmr vaccine was responsible for triggering these events.","","","discusses","coci_wakefield_ret_intext_ref.csv"
"disputes","","","10.1111/j.1469-7610.2005.01425.x","introduction","","","","","","","","","publication of a study claiming a causal relationship between the measles, mumps, and rubella (mmr) vaccine and autism spectrum disorders (asd) (wakefield, 1999; wakefield et al., 1998) sparked a heated debate, primarily in the usa and uk, which relates not only to the etiology of asd, but also impacts immunization policy. among data used to argue the case are asd frequency studies.","","","disputes","coci_wakefield_ret_intext_ref.csv"
"discusses","problematically bold or cautious rhetorical styles ","","10.1207/s15427625tcq1403_4","","","","","","","","","","the link between autism and early childhood vaccinations, publicized in the media and debated in congress, persuaded countless parents to decide against vaccinating their children, leading to outbreaks of measles and other infections in several states. the bold rhetorical style employed in the original study (wakefield et al.) possibly contributed to misreading of its findings by lay journalists who were incapable of assessing the statistical data or the interpretive methods that scientists in wakefield’s field saw as flawed. wakefield eventually retracted his study (wakefield).","","","discusses","coci_wakefield_ret_intext_ref.csv"
"credits","","","10.1093/fampra/cmi066","introduction","","","","","","","","","recent developments make this a particularly apposite time to consider parental attitudes towards mmr vaccination of their children. parental concerns over safety of the vaccine have been clearly visible since the initial suggestion by wakefield and colleagues1 of a possible link between children's receipt of the vaccine, gastrointestinal disease and autistic-spectrum disorders. publication of this suggested link was followed by a decline in uptake rates of the combined mmr vaccine across the uk, in some parts to as low as 61.4%.2","","","credits","coci_wakefield_ret_intext_ref.csv"
"disputes","","","10.1093/fampra/cmi066","introduction","","","","","","","","","in this, parental behaviour is consistent with that found in relation to vaccination generally22 and other health behaviours involving perceptions of risks.23
we report here the results of a study of the factors that predict parents' decisions for and against mmr vaccination of their children, in the light of renewed criticism of the wakefield et al. study.1 in this study we aimed (a) using a ‘bottom-up’ approach, to identify the factors relevant to both immunising and non-immunising parents, and (b) to investigate the extent to which the identified factors predicted immunisation or non-immunisation.","","","disputes","coci_wakefield_ret_intext_ref.csv"
"cites for information","","","10.1207/s15326888chc3403_4","introduction","","","","","","","","","one observable indicator of delayed gastric emptying is constipation. 
preliminary evidence has suggested that some children with autism and other pdds may experience gastrointestinal problems (horvath, papadimitriou, rabsztyn, drachenberg, & tildon, 1999; lightdale et al., 2001; wakefield et al., 1998; williams et al., 2000). o’moore (1978) reported that approximately 20% of children with autism or pdd experienced constipation.","","","cites for information","coci_wakefield_ret_intext_ref.csv"
"credits","s o is t h e r e a m e d i c a l m a l p r a c t i c e c r i s i s ?","","10.1111/j.1748-720x.2005.tb00511.x","","","","","","","","","","according to the chief medical officer’s report, there are 2,900 potential claim ants following upon the heels of the selead~ases.7~ 
another recent medical“scandal”arose as a result of a piece of medical research which suggested that the triple vaccine mmr (mumps, measles and rubella) caused inflammatory bowel disease and this in turn caused autism. the source of this was a single journal article72 which was later discredited.","","","credits","coci_wakefield_ret_intext_ref.csv"
"cites as evidence","","","10.1111/j.1469-7610.2004.00391.x","introduction","","","","","","","","","however, interaction with environmental risk factors has also been proposed. several risk factors have been investigated, e.g., maternal obstetrical complications (burd, severud, kerbeshian, & klug, 1999; eaton, mortensen, thomsen, & frydenberg, 2001; hultman, sparen, & cnattingius, 2002; glasson et al., 2004), viral infections during pregnancy (chess, 1971; wilkerson, volpe, dean, & titus, 2002), maternal age (burd et al., 1999; croen, grether, & selvin, 2002), immunological abnormalities (korvatska, van de water, anders, & gershwin, 2002), vaccines (wakefield et al., 1998; madsen et al., 2002), and season of birth (bolton, pickles, harrington, macdonald, & rutter, 1992), but the specific etiology remains unknown.
most studies investigating risk factors of autism are based on prevalence rather than incidence.","","","cites as evidence","coci_wakefield_ret_intext_ref.csv"
"disputes","recent controversies surrounding immunization ","","10.1542/neo.6-10-e463","","","","","","","","","","the routine usage of oral polio vaccine in the united states was discontinued when the incidence of natural disease fell below the threshold for risk of vaccine-associated paralysis. (10) 
in the 1990s, dr andrew wakefield published a series of now discredited studies involving fewer than 20 patients that suggested a link between mmr vaccine and autism in great britain. (11) several large epidemiologic studies published in the british medical journal and the journal of the american medical association found no association between mmr vaccine and autism in european or american children.","","","disputes","coci_wakefield_ret_intext_ref.csv"
"disputes","alleged or unclear metabolic abnormalities","","10.1024/1422-4917.33.4.259","","","","","","","","","","in 1998, 12 patients with autism and concomitant bowel disease were reported. it has been speculated that a previous measles, mumps, and rubella vaccination could have caused both the neurological symptoms and the intestinal problems (wakefield et al. 1998). several subsequent studies made this postulated connection very unlikely.","","","disputes","coci_wakefield_ret_intext_ref.csv"
"critiques","","","10.1038/sj.embor.7400544","","","","","","","","","","this may just be a reflection of human nature, but serious harm can be done when a tiny but vocal minority distorts policies. such was the case in the uk over the mumps, measles, rubella (mmr) vaccine. in 1998, the lancet published a study that suggested a causal link between the vaccine and autism in children (wakefield et al, 1998). although the publication was later retracted (murch et al, 2004), the public perceived the scie.jpgic community as divided over the link between mmr and autism, when in fact the vast majority accepted that the vaccine was safe.","","","critiques","coci_wakefield_ret_intext_ref.csv"
"disputes","","","10.1038/sj.mp.4001757","introduction","","","","","","","","","viral infections during or after pregnancy have been associated with autism in some infants, typically with viruses such as rubella,12 hemophilus influenzae and cytomegalovirus.13 measles, mumps, and rubella vaccination also has been related to autism,14 but no evidence for this relationship has been found in several other studies.15, 16, 17 furthermore, it has been suggested that the mercury-based preservatives of vaccines increase the risk for autism, but this hypothesis has met criticism.18","","","disputes","coci_wakefield_ret_intext_ref.csv"
"disputes","","","10.1093/eurpub/cki194","introduction","","","","","","","","","during the mid-1990s, a link was postulated between measles vaccination and crohn's disease.2 subsequently, in february 1998, a paper was published3 suggesting a link between the vaccine and autistic spectrum disorders (asds), which subsequently received substantial media coverage. several subsequent studies and reviews concluded that there was no evidence of such a link.4–7","","","disputes","coci_wakefield_ret_intext_ref.csv"
"describes","","","10.1007/s10202-005-0002-3","introduction","","","","","","","","","a paper written by andrew wakefield and others was published in the lancet in 1998 suggesting grounds for a possible association between the measles, mumps and rubella (mmr) combined vaccine and bowel problems and autism. 
footnote
1 the paper was based on a study of only twelve children and explicitly stated that the authors had no evidence strong enough to establish a causal link between the vaccine and the health problems.","","","describes","coci_wakefield_ret_intext_ref.csv"
"obtains background from","","","10.1002/14651858.cd004407.pub2","","","","","","","","","","wakefield 1998","","","obtains background from","coci_wakefield_ret_intext_ref.csv"
"discusses","","","10.1111/j.1354-4187.2005.00304.x","introduction","","","","","","","","","there has been debate about whether the frequency of diagnoses of autism has risen since the 1980s and the introduction of the mmr (see frith 2003). some commentators have proposed a link between these two issues and conclude that there is a causal link between mmr and the development of autism (wakefield et al. 1998). the assumption is that the mmr gives rise to a nonspecific gut condition which allows for the absorption of nonpermeable peptides into the body which is hypothesized to lead to the development of autism (see nicoll et al. 1998 for a critique of this hypothesis).","","","discusses","coci_wakefield_ret_intext_ref.csv"
"qualifies","","","10.1111/j.1354-4187.2005.00304.x","introduction","","","","","","","","","this time period provides a ‘hot spot’ of activity, debate and concern about the mmr vaccination due to the intense media reporting on mmr and the number of research projects investigating the link between mmr and autism at this time. these included a research project (wakefield et al. 1998) which gave evidence for the link between mmr and the development of autism and entercolitis syndrome (also termed as the autistic entercolitis syndrome). in addition there was also high levels of media interest in the actions of the british prime minister who was endorsing as the only safe option for children.","","","qualifies","coci_wakefield_ret_intext_ref.csv"
"cites as evidence","discussion","","10.1177/1362361305057880","introduction","","","","","","","","","the causes of autistic regression are not known. one hypothesis is that regression is due to complications of infection (delong et al., 1981; gupta et al., 1984), epilepsy or subclinical epileptiform discharges (stefanatos et al., 2002), vaccination (wakefield et al., 1998), or environmentally mediated exposures (e.g. mercury: bernard et al., 2001). a competing theory is that regression, like early onset autism (bolton et al., 1994), is largely genetically influenced, but that the genes have a later onset of action.","","","cites as evidence","coci_wakefield_ret_intext_ref.csv"
"discusses","discussion","","10.1177/1362361305057880","introduction","","","","","","","","","this replicates earlier research findings that children with autism do not differ significantly from children with developmental delays in terms of their attachment security (dissanayake and crossley, 1997; rogers et al., 1991). 
the measles–mumps–rubella (mmr) vaccine has received much recent attention after being hypothesized as a potential causal agent in autism (wakefield et al., 1998). although this study did not explicitly investigate causal mechanisms underlying regression, parent perceptions of possible precipitating events were collected.","","","discusses","coci_wakefield_ret_intext_ref.csv"
"cites as evidence","evidence for a glutathione deficiency and oxidative stress in children with autism","","10.1080/10937400600882079","introduction","","","","","","","","","many theories were postulated regarding the underlying cause of autism. for example, autism was implicated to be related to the measles, mumps, and rubella vaccine (wakefield et al., 1998, 2000; wakefield, 2003); mercury in vaccines (bernard et al., 2002; mcginnis, 2001); immune system dysfunction (cohly and panja, 2005; warren et al., 1990, 1992, 1995; singh et al., 1993; weizman et al., 1982); fungal infection (; shaw, 1996), toxicity (mcfadden, 1996); metabolic abnormalities (waring and klovrza, 2000; waring and o'reilly, 1990; alberti et al., 1999); and “leaky gut syndrome”(vantrappen and geboes, 1993). most recently, studies have suggested that decreased glutathione levels and increased oxidative stress may play a role in the pathology (james et al., 2004).","","","cites as evidence","coci_wakefield_ret_intext_ref.csv"
"cites as evidence","evidence for a glutathione deficiency and oxidative stress in children with autism","","10.1080/10937400600882079","introduction","","","","","","","","","low glutathione levels may underlie many of the systemic abnormalities associated with autism. in autism, there is evidence for: (1) oxidative stress and lipid peroxidation; (2) toxicity, such as phenolic compounds (edelson and cantor, 1998) and toxic metals (lonsdale, 2002; filipek et al., 1999; eppright et al., 1996; holmes et al., 2003); (3) immune dysfunction, such as impaired or altered immune response and dysregulation of inflammatory cytokines (cohly and panja, 2005; warren et al., 1990, 1992, 1995); and (4) impaired gastrointestinal integrity, such as epithelial pathology and increase gut permeability (d'eufemia et al., 1996; wakefield et al., 1998, 2000; furlano et al., 2001; horvath et al. 1999). gsh is important in each of these physiological processes. the following section describes what gsh is and how gsh is involved in these physiological processes.","","","cites as evidence","coci_wakefield_ret_intext_ref.csv"
"disputes","examination of possible causes of autism
","","10.1146/annurev.clinpsy.2.022305.095210","","","","","","","","","","the best studied of these is the increased risk of autism with congenital rubella syndrome (chess 1971). others have invoked this mechanism for the putative causal role of the measles, mumps, and rubella vaccine (wakefield et al. 1998), although this has largely been refuted by epidemiological studies (madsen et al. 2002, taylor et al. 1999).
it has also been suggested that individuals with autism have a disordered immunity with both decreased and increased function of different segments of the immune system having been reported (see hornig & lipkin 2001 for a review).","","","disputes","coci_wakefield_ret_intext_ref.csv"
"discusses","stage 3: plausibility and likelihood of acceptance of linear predictive narratives ","","10.1108/09513570610670334","","","","","","","","","","subsequently a study investigating a link between bowel disease and autism noted that:
in eight children, the onset of behavioural problems had been linked, either by the parents or by the child's physician, with measles, mumps, and rubella vaccination (wakefield et al., 1998, p. 638).

although investigation of such a link had not been a key objective of the study, and although the researchers noted that they had not proved a link between the mmr vaccine and a form of autism, they concluded that:","","","discusses","coci_wakefield_ret_intext_ref.csv"
"discusses","stage 3: plausibility and likelihood of acceptance of linear predictive narratives ","","10.1108/09513570610670334","","","","","","","","","","in most cases, onset of symptoms was after measles, mumps, and rubella immunisation. further investigations are needed to examine this syndrome and its possible relation to this vaccine (wakefield et al., 1998, p. 641).
this latter point was reportedly reinforced by the lead researcher on this project in a press conference announcing the results of the study (the independent, 2004).","","","discusses","coci_wakefield_ret_intext_ref.csv"
