citation,volume,title,page,reference,citation_count,oa_link,author,doi,issue,source_title,source_id,year
"","33","Book Review: Industrial Sexuality: Gender, Urbanization, And Social Transformation In Egypt By Hanan Hammad","987-989","","0","","Wilson, Eli R., 0000-0002-2354-0734","10.1177/0891243219846501","6","Gender & Society","issn:0891-2432; issn:1552-3977","2019"
"","","Retracted Article: A Nation Within A Nation: Organizing African-American Communities Before The Civil War","1-2","","0","","Robinson, Stephen","10.1080/14664658.2012.746274","","American Nineteenth Century History","issn:1466-4658; issn:1743-7903","2012"
"10.1080/03323315.2017.1327366; 10.1123/ssj.2017-0088","18","Retracted Article: Retraction: From Courtyard Sport To Competitive Sport: Evolution Of Wrestling In Colonial Bengal","1-16","10.1525/california/9780520076976.001.0001; 10.1525/can.1993.8.1.02a00030","2","","","10.1080/17430437.2014.919258","1","Sport In Society","issn:1743-0437; issn:1743-0445","2014"
"","96","Withdrawn: Sedimentary Facies, Sequence Stratigraphy And Diagenesis Of Mixed Fluvial Siliciclastic-Marine Carbonate Deposits Of The Lower Miocene Razak Formation At Sarkhun Gas Field, Zagros Basin, Se Iran: A Linkage With Reservoir Quality","646","","0","","Amel, H.; Wanas, H.A.; Jafarian, A.; Amel, A.; Ghazi, S.; Caja, M.A.","10.1016/j.marpetgeo.2018.02.018","","Marine And Petroleum Geology","issn:0264-8172","2018"
"10.1177/0883073811432749; 10.1007/s00381-011-1493-y; 10.1590/s1981-81222014000100002; 10.1002/ajpa.22832; 10.3171/2012.6.focus12120; 10.3171/2014.1.focus13466","29","A Look At Mayan Artificial Cranial Deformation Practices: Morphological And Cultural Aspects [Retracted]","E2","10.1002/ajpa.1330790213; 10.1086/resv33n1ms20167006; 10.1227/00006123-199509000-00002; 10.1227/01.neu.0000255462.99516.b0","6","","Romero-Vargas, Samuel; Ruiz-Sandoval, José Luis; Sotomayor-González, Arturo; Revuelta-Gutiérrez, Rogelio; Celis-López, Miguel Angel; Gómez-Amador, Juan Luis; García-González, Ulises; López-Serna, Raul; García-Navarro, Victor; Mendez-Rosito, Diego; Correa-Correa, Victor; Gómez-Llata, Sergio","10.3171/2010.9.focus10200","6","Neurosurgical Focus","issn:1092-0684","2010"
"10.1007/s12565-017-0399-5","33","Knowledge Of Skull Base Anatomy And Surgical Implications Of Human Sacrifice Among Pre-Columbian Mesoamerican Cultures [Retracted]","E1","10.1002/evan.20046; 10.1002/oa.1135; 10.1016/b978-012369364-8/50257-6; 10.1016/j.wneu.2010.08.018; 10.3171/2010.9.focus10200","1","","Lopez-Serna, Raul; Gomez-Amador, Juan Luis; Barges-Coll, Juan; Arriada-Mendicoa, Nicasio; Romero-Vargas, Samuel; Ramos-Peek, Miguel; Celis-Lopez, Miguel Angel; Revuelta-Gutierrez, Rogelio; Portocarrero-Ortiz, Lesly","10.3171/2012.6.focus12120","2","Neurosurgical Focus","issn:1092-0684","2012"
"","0","La Democracia Orgánica: Participación Y Representación Política En La España De Franco = Organic Democracy: Political Participation And Representation In Franco’S Spain","107","","0","http://revistas.uned.es/index.php/ETFV/article/download/15751/13696","Giménez Martínez, Miguel Ángel","10.5944/etfv.27.2015.15751","27","Espacio Tiempo Y Forma. Serie V, Historia Contemporánea","issn:1130-0124","2015"
"","31","Retraction Notice","i-i","","0","","","10.1093/fh/crn067","4","French History","issn:0269-1191; issn:1477-4542","2017"
"","65","[Desautorizado] La Revolución Cubana Y La Historiografía","297","","0","http://estudiosamericanos.revistas.csic.es/index.php/estudiosamericanos/article/download/106/111","Aguilera Manzano, José María","10.3989/aeamer.2008.v65.i1.106","1","Anuario De Estudios Americanos","issn:1988-4273; issn:0210-5810","2008"
"","1656","Ceramics At The Emergence Of The Silk Road: A Case From Southeastern Kazakhstan","","10.1007/bf02681334; 10.1007/s00253-003-1354-z; 10.1017/cbo9781139061186.008; 10.1017/s0003598x00092280; 10.1179/0093469012z.00000000037","0","","Heinsch, Maryfran; Vandiver, Pamela B.; Lyublyanovics, Kyra; Choyke, Alice M.; Tourtellotte, Perry; Chang, Claudia","10.1557/opl.2014.430","","Mrs Proceedings","issn:1946-4274","2014"
"","10","Blasts From The Past: War And Fracture In The International System","352-368","","0","","Bartelson, Jens","10.1093/ips/olw019","4","International Political Sociology","issn:1749-5679; issn:1749-5687","2016"
"10.1007/978-3-319-30534-9_17-1","1","Historical Perspective On Public Support For The Draft: War Costs And Military Service","303-322","10.1017/cbo9780511664984; 10.1017/s0003055408080027; 10.1017/s0003055411000141; 10.1017/s0020818310000226; 10.1017/s0020818312000057; 10.1017/s0022381611000119; 10.1017/s104909651100059x; 10.1086/268474; 10.1093/poq/nfl021; 10.1093/poq/nfp024; 10.1093/poq/nfq001; 10.1093/sf/57.3.824; 10.1111/0022-3816.00006; 10.1111/j.1468-2478.2011.00679.x; 10.1111/j.1468-2508.2007.00602.x; 10.1111/j.1540-5907.2005.00144.x; 10.1162/016228805775969573; 10.1177/000312240807300408; 10.1177/0022002703258803; 10.1177/0022002705281151; 10.1177/0022002798042004001; 10.1177/0095327x11428786; 10.1515/9781400842919; 10.2307/2111544; 10.2307/2585574; 10.2307/2600916; 10.7208/chicago/9780226043463.001.0001","1","","Fordham, Benjamin O.","10.1093/jogss/ogw014","4","Journal Of Global Security Studies","issn:2057-3170; issn:2057-3189","2016"
"","64","Social Mobility In The Early Middle Ages","111-120","","0","","Meinzer, Nicholas J.","10.1016/j.eeh.2016.08.001","","Explorations In Economic History","issn:0014-4983","2017"
"10.1080/13183222.2015.1129203","30","Partial Retraction: Legacy Of Elisabeth Noelle-Neumann: The Spiral Of Silence And Other Controversiesdonsbachwolfgangsalmoncharles T.Tsfatiyariv (Eds) The Spiral Of Silence: New Perspectives On Communication And Public Opinion, Routledge, New York, 2014; 248 Pp.: £27.76Beckerjörgelisabeth Noelle-Neumann: Demoskopin Zwischen Ns-Ideologie Und Konservatismus, Verlag Ferdinand Schöningh, Paderborn, 2013; 379 Pp.: €29.90","353-363","10.1007/978-3-322-87749-9_2; 10.1111/j.1460-2466.1974.tb00367.x; 10.1111/j.1467-923x.1940.tb00552.x","1","","Splichal, Slavko","10.1177/0267323115589265","3","European Journal Of Communication","issn:0267-3231; issn:1460-3705","2015"
"10.1080/13183222.2015.1129203","30","Partial Retraction: Legacy Of Elisabeth Noelle-Neumann: The Spiral Of Silence And Other Controversiesdonsbachwolfgangsalmoncharles T.Tsfatiyariv (Eds) The Spiral Of Silence: New Perspectives On Communication And Public Opinion, Routledge, New York, 2014; 248 Pp.: £27.76Beckerjörgelisabeth Noelle-Neumann: Demoskopin Zwischen Ns-Ideologie Und Konservatismus, Verlag Ferdinand Schöningh, Paderborn, 2013; 379 Pp.: €29.90","353-363","10.1007/978-3-322-87749-9_2; 10.1111/j.1460-2466.1974.tb00367.x; 10.1111/j.1467-923x.1940.tb00552.x","1","","Splichal, Slavko","10.1177/0267323115589265","3","European Journal Of Communication","issn:0267-3231; issn:1460-3705","2015"
"","69","Producción Y Mano De Obra En Las Haciendas Jesuíticas Del Buenos Aires Colonial: La Chacarita Y Las Conchas En El Siglo Xviii","627-663","","0","http://estudiosamericanos.revistas.csic.es/index.php/estudiosamericanos/article/download/582/585","Olivero Guidobono, Sandra","10.3989/aeamer.2012.2.09","2","Anuario De Estudios Americanos","issn:1988-4273; issn:0210-5810","2012"
"10.1002/9781119265955.ch11","","Retracted Chapter: Michael Baius (1513–89) And The Debate On ‘Pure Nature’: Grace And Moral Agency In Sixteenth-Century Scholasticism","51-90","","1","","Stone, M. W. F.","10.1007/1-4020-3001-0_4","","Moral Philosophy On The Threshold Of Modernity - The New Synthese Historical Library","isbn:9781402030000; isbn:9781402030017","2005"
"","20","Retracted Article: On ‘Presence’ And Conversing With The Past: Do Historians Communicate With The Past?","(v)-(x)","10.1111/j.1468-229x.2011.00543_1.x; 10.4324/9780203426111","0","","Munslow, Alun","10.1080/13642529.2014.915496","1","Rethinking History","issn:1364-2529; issn:1470-1154","2014"
"10.2105/ajph.2015.1057.1726","105","Child Farm Laborers","1312-1312","","1","https://www.ncbi.nlm.nih.gov/pmc/articles/PMC4463389","Win, Aung Zaw","10.2105/ajph.2015.302623","7","American Journal Of Public Health","issn:0090-0036; issn:1541-0048","2015"
"10.1186/s12991-014-0030-2","13","Sacred Psychiatry In Ancient Greece","11","10.1016/j.brainresbull.2006.09.020; 10.1521/jaap.30.1.53.21983","1","https://annals-general-psychiatry.biomedcentral.com/track/pdf/10.1186/1744-859X-13-11","Tzeferakos, Georgios; Douzenis, Athanasios","10.1186/1744-859x-13-11","1","Annals Of General Psychiatry","issn:1744-859X","2014"
"10.1075/ceb.10.15sch","14","Retracted Article: Who Will Carry The Word? The Threshold Between Unspeakability And Silence In The Holocaust Narratives Of Charlotte Delbo And Jorge Semprun","37-48","","1","","Sánchez-Pardo, Esther","10.1080/13825571003588429","1","European Journal Of English Studies","issn:1382-5577; issn:1744-4233","2010"
"10.3390/rel9070213; 10.1002/casp.699; 10.1080/09668136.2011.547697; 10.1080/13691830601154294; 10.1177/1750698016650485; 10.1080/14623520305660; 10.1177/0309132507087647; 10.1177/1468797615588425; 10.1177/1468797616635371; 10.1002/9781118257203.ch15; 10.1177/1463499605050866; 10.1080/00343400050192856; 10.1590/s0104-71832013000200016; 10.1057/9781137330727_7; 10.1017/s1755048314000789; 10.1080/01419870.2010.522245; 10.1080/01419870.2011.535548; 10.1080/01419870.2011.556748","23","Warlords, Priests And The Politics Of Ethnic Cleansing: A Case-Study From Rural Bosnia Hercegovina","16-36","","18","https://research.vu.nl/ws/files/1643772/127642.pdf","Bax, Mart","10.1080/014198700329114","1","Ethnic And Racial Studies","issn:0141-9870; issn:1466-4356","2000"
"","17","Retracted Article: A Catalog Of Aftershock Sequences In Greece (1998–2008) And Their Spatial And Temporal Characteristics","1107-1107","10.1007/bf00879500; 10.1016/b978-1-4832-2982-9.50009-7; 10.1023/a:1011473432628; 10.1111/j.1365-246x.1996.tb05272.x","0","https://link.springer.com/content/pdf/10.1007%2Fs10950-012-9310-y.pdf","Baskoutas, Ioannis; Papanastassiou, Dimitrios","10.1007/s10950-012-9310-y","3","Journal Of Seismology","issn:1383-4649; issn:1573-157X","2012"
"10.5339/messa.2014.5; 10.1007/s11205-013-0247-5","20","This Article Has Been Retracted","352-375","","2","","","10.1093/jis/etp023","3","Journal Of Islamic Studies","issn:0955-2340; issn:1471-6917","2009"
"","","Dummy Article Title","","10.1215/08992363-15-1-11","0","https://link.springer.com/content/pdf/10.1007%2Fs10691-018-9390-3.pdf","","10.1007/s10691-012-9194-9","","Feminist Legal Studies","issn:0966-3622","2012"
"","15","Withdrawn: Investigating The Need Of Nuclear Power Plants For Sustainable Energy In Iran","3575-3587","","0","","Mazandarani, A.","10.1016/j.rser.2011.05.014","8","Renewable And Sustainable Energy Reviews","issn:1364-0321","2011"
"","","Notice Of Retraction: On Generation And Development Of Railway Elementary Education In China (From 1898 To 1949)","","","0","","Meiyan Ding","10.1109/aimsec.2011.6009702","","2011 2Nd International Conference On Artificial Intelligence, Management Science And Electronic Commerce (Aimsec)","","2011"
"10.1007/s40656-018-0206-1; 10.1007/s10670-016-9815-9; 10.1080/17522439.2013.845593","42","Withdrawn: Thought Styles And Paradigms: A Comparative Study Of Ludwik Fleck And Thomas S. Kuhn","416-425","","3","","Mößner, Nicola","10.1016/j.shpsa.2011.02.001","3","Studies In History And Philosophy Of Science Part A","issn:0039-3681","2011"
"","","Notice Of Retraction: Study On Development History And Policy Of Industrial Design In China","","10.1017/cbo9781139173513; 10.1111/j.1468-0289.2005.00306.x","0","","Fang, Wei; Zhaofang, Huang","10.1109/icpim.2011.5983681","","2011 International Conference On Product Innovation Management (Icpim 2011)","","2011"
"","","Notice Of Retraction: Study Of The Relationship Between Ipo Market Timing And Capital Structure Of Real Estate Companies Econometric Evidence From The Panel Data Of Hong Kong Main Board Stock Market","","10.1016/s0304-405x(01)00044-7","0","","Li, Gao Chun; Feng, Lan","10.1109/icbmei.2011.5918013","","2011 International Conference On Business Management And Electronic Information","","2011"
"","","Notice Of Retraction: The Factor Contribution To The Chinese Industry Growth: 1952–2007","","10.1006/jcec.2000.1684; 10.2307/1926047; 10.2307/2118409","0","","Zeng Xian-Feng; Li Guo-Ping","10.1109/icbmei.2011.5920919","","2011 International Conference On Business Management And Electronic Information","","2011"
"","","Notice Of Retraction: Analysis On The Dynamic Mechanism Of R & D Industry","","10.1016/0048-7333(93)00751-e","0","","Shun-Cai, Li; Hai-Lian, Lai; Yue-Shi, Hu","10.1109/icebeg.2011.5882087","","2011 International Conference On E-Business And E-Government (Icee)","","2011"
"","","Philosophy And Theology","687-706","","0","","Stone, M. W. F.; Wisnovsky, Robert","10.1017/chol9780521762182.013","","The Cambridge History Of Medieval Philosophy","isbn:9781139095440","2009"
"10.1038/s41598-017-03500-7; 10.1016/j.yqres.2011.06.002; 10.1016/j.yqres.2013.05.001; 10.1017/qua.2018.56; 10.1177/0959683611400195; 10.1177/0959683611400218; 10.1659/mrd-journal-d-09-00057.1; 10.1007/978-3-319-30475-5_1; 10.1007/s11430-015-5482-x","19","This Article Has Been Retracted: What Caused The Mid-Holocene Forest Decline On The Eastern Tibet-Qinghai Plateau?","278-286","10.1002/(sici)1099-1417(200003)15:3<273::aid-jqs504>3.0.co;2-2; 10.1007/978-94-009-3081-0_1; 10.1007/bf00028046; 10.1007/pl00007919; 10.1007/s00334-006-0075-5; 10.1007/s003820050122; 10.1007/s00382-004-0469-y; 10.1007/s00382-005-0007-6; 10.1007/s004390000406; 10.1007/s11258-007-9282-0; 10.1007/s11434-007-0086-3; 10.1016/0031-0182(91)90041-o; 10.1016/0031-0182(95)00032-1; 10.1016/j.catena.2006.04.028; 10.1016/j.catena.2007.12.001; 10.1016/j.chemgeo.2006.07.005; 10.1016/j.ecolmodel.2005.05.018; 10.1016/j.epsl.2005.01.036; 10.1016/j.jas.2006.06.016; 10.1016/j.palaeo.2005.09.017; 10.1016/j.palaeo.2006.05.010; 10.1016/j.palaeo.2007.07.007; 10.1016/j.palaeo.2008.11.004; 10.1016/j.palaeo.2009.03.005; 10.1016/j.quaint.2004.11.014; 10.1016/j.quaint.2007.12.002; 10.1016/j.quaint.2008.09.008; 10.1016/j.quascirev.2005.02.006; 10.1016/j.quascirev.2007.10.017; 10.1016/j.quascirev.2008.12.015; 10.1016/j.quascirev.2009.01.009; 10.1016/j.quascirev.2009.03.007; 10.1016/j.yqres.2006.03.001; 10.1016/s0012-821x(02)00829-4; 10.1016/s0012-821x(03)00207-3; 10.1016/s0031-0182(99)00064-4; 10.1016/s0277-3791(98)00115-2; 10.1016/s1571-0866(07)09010-0; 10.1016/s1571-0866(07)09011-2; 10.1023/a:1008038808690; 10.1023/a:1024858532005; 10.1023/b:clim.0000004577.17928.fa; 10.1023/b:jowo.0000038657.79035.9e; 10.1029/1999gl900494; 10.1029/2001gb001662; 10.1038/353742a0; 10.1080/00438240600813301; 10.1111/j.1365-294x.2007.03459.x; 10.1126/science.1083130; 10.1126/science.214.4516.59; 10.1126/science.276.5320.1821; 10.1127/0006-8152/2005/0126-0273; 10.1177/0959683608091801; 10.1186/1471-2148-6-73; 10.1191/0959683606hl923rp; 10.1360/02wd0272; 10.1659/mrd.0792; 10.1890/06-2016.1","9","","Herzschuh, Ulrike; Birks, H. John B.; Liu, Xingqi; Kubatzki, Claudia; Lohmann, Gerrit","10.1111/j.1466-8238.2009.00501.x","2","Global Ecology And Biogeography","issn:1466-822X","2009"
"","","Notice Of Retraction: The Integrated Frameworks For Studying Spatial Morphology Of Historical City Evolution","","10.1017/cbo9780511597237; 10.1068/b250059; 10.1177/0013916503261384; 10.1177/0013916591233001","0","","Lu Zheng; Guo Weimin; Zhou Xuan","10.1109/iceit.2010.5608425","","2010 International Conference On Educational And Information Technology","","2010"
"","132","St. Luke And His Cult As Holy Healer Of The Serbs","364-368","","0","https://doi.org/10.2298/sarh0410364m","Mitrovic, Zorica; Markovic, Ljiljana; Nenadovic, Maja","10.2298/sarh0410364m","9-10","Srpski Arhiv Za Celokupno Lekarstvo","issn:0370-8179","2004"
"","","Notice Of Retraction: Analysis Of The Characters Of The Geographic Distribution Of The World'S Extra-Large Cities","","","0","","Lin Zhang; Zhang Long; Binwen Zou","10.1109/esiat.2010.5568983","","2010 The 2Nd Conference On Environmental Science And Information Application Technology","","2010"
"","","Notice Of Retraction: Human Activities And Lake Evolution In The Middle Reaches Of Yangtze River","","","0","","Huang, Jian-Wu; Tian, Ya-Jing","10.1109/esiat.2010.5567270","","2010 The 2Nd Conference On Environmental Science And Information Application Technology","","2010"
"","","Notice Of Retraction: Big Country Dependent Economy Development Of Taiwan—Functions Of Japan, The Us, And China In Taiwan'S Economy Development","","","0","","Jung Hsiung-Shen; Ting-Sheng Weng","10.1109/icams.2010.5553270","","2010 Ieee International Conference On Advanced Management Science(Icams 2010)","","2010"
"","","Notice Of Retraction: Study Of Integration Innovation Of Modern Industrial Eengineering Technologies Based On Lean Thinking","","","0","","Shu Jun-Yi; Shi Xue-Gang","10.1109/icams.2010.5553148","","2010 Ieee International Conference On Advanced Management Science(Icams 2010)","","2010"
"","","Notice Of Retraction: The Evolution And Historical Role Of Examination System In Ancient China","","","0","","Xie Li-Zhi","10.1109/iccet.2010.5486054","","2010 2Nd International Conference On Computer Engineering And Technology","","2010"
"","","Notice Of Retraction: The Research Of Analysis And Designing For History- Educational Games","","","0","","Ling He; Xiaoqiang Hu; Xianmei Jiang","10.1109/iccet.2010.5485551","","2010 2Nd International Conference On Computer Engineering And Technology","","2010"
"","33","Slavery And Medicine In The Caribbean At The End Of Theancien Régime","383-401","","0","","Aguilera-Manzano, José María","10.1080/03071020802410312","4","Social History","issn:0307-1022; issn:1470-1200","2008"
"","","Notice Of Retraction: Sorcery, Taoism, Polytheism, Sao - Sources Of Chu Art'S Spiritual Images","","","0","","Yang Sibao","10.1109/caidcd.2009.5374938","","2009 Ieee 10Th International Conference On Computer-Aided Industrial Design & Conceptual Design","","2009"
"10.1017/s1053837209090051","75","Probabilism And Its Methods","359-394","","1","","Stone, M.W.F.; Van Houdt, T.","10.2143/etl.75.4.504765","4","Ephemerides Theologicae Lovanienses","issn:0013-9513","1999"
"10.1080/00048400802215687","67","The Origins Of Probabilism In Late Scholastic Moral Thought","114-157","","1","","Stone, M.W.F.","10.2143/rtpm.67.1.520","1","Recherches De Théologie Et Philosophie Médiévales","issn:1370-7493","2000"
"","","Notice Of Retraction: An Econometric Analysis Of Development Dynamics In Modern Chinese Industry","","","0","","Wang Ai-Ling","10.1109/iccsit.2009.5234868","","2009 2Nd Ieee International Conference On Computer Science And Information Technology","","2009"
"10.1260/1369-4332.16.7.1311","9","The Importance Of Bonding — A Historic Overview And Future Possibilities","721-736","10.1016/0262-5075(88)90033-4; 10.1016/0950-0618(90)90007-n; 10.1016/s0142-9612(03)00257-6; 10.1016/s0143-7496(96)00014-0; 10.1016/s0950-0618(03)00043-6; 10.1017/cbo9780511529597; 10.1061/(asce)0733-9445(2001)127:7(784); 10.1061/(asce)0899-1561(1997)9:4(206); 10.1529/biophysj.105.065268; 10.1533/9781845690755.1.23; 10.1533/9781845690755.1.3; 10.1533/9781845690755.1.75; 10.1533/9781845690755.3.357; 10.1533/9781845690755.3.489; 10.2749/101686602777965522","1","http://ltu.diva-portal.org/smash/get/diva2:1008062/FULLTEXT01","Täljsten, B.","10.1260/136943306779369509","6","Advances In Structural Engineering","issn:1369-4332; issn:2048-4011","2006"
"","11","Partition And Its Precedents","591-596","10.2307/2539045","0","","Getso, Robert","10.1080/10402659908426312","4","Peace Review","issn:1040-2659; issn:1469-9982","1999"
"","41","A History Of Medical Reports On The Boston Marathon","257-264","10.1001/archinte.1924.00110280023003; 10.1001/jama.1918.02600390031009; 10.1001/jama.1924.02650480034015; 10.1001/jama.1925.02670070028009; 10.1001/jama.1942.02830430064025; 10.1016/j.amjmed.2006.06.028; 10.1056/nejm190302191480801; 10.1080/00913847.1988.11709599; 10.1136/bmj.311.7021.1660; 10.1161/01.cir.76.6.1206; 10.1172/jci105735; 10.1249/00005768-198506000-00012; 10.1309/prf5n7p2xm6e243h; 10.7326/0003-4819-100-6-846; 10.7326/0003-4819-84-6-704","0","","Thompson, Paul D.; Venero, Carmelo V.","10.1249/mss.0b013e3181878067","2","Medicine & Science In Sports & Exercise","issn:0195-9131","2009"
"","","Withdrawn: Ecological Value At Risk: The Temporal Analysis Of The Emergy Ecological Footprint And Biological Capacity In Gansu, China 1980–2020","","","0","","Wei, Xiaohong; Li, Zizhen","10.1016/j.ecolecon.2009.03.006","","Ecological Economics","issn:0921-8009","2009"
"","6","The Antiquarian And The Moderniser: Giovanni Lorenzo Berti (1696-1766), Pietro Tamburini (1737-1827), And Contrasting Defenses Of The Augustinian Teaching On Unbaptised Infants In Eighteenth-Century Italy","335-372","","0","","Stone, Martin W.F.","10.1484/j.quaestio.1.100071","","Quaestio","issn:1379-2547; issn:2295-9033","2006"
"","","Aristotelianism And Scholasticism In Early Modern Philosophy This Chapter Has Been Retracted","7-24","10.1017/cbo9780511487309; 10.1017/cbo9780511598524; 10.4159/harvard.9780674432819","0","","Stone, M. W. F.","10.1002/9780470998847.ch2","","A Companion To Early Modern Philosophy","isbn:9780470998847; isbn:9780631218005","2008"
"10.1007/978-3-476-05321-3_5","","Scholastic Schools And Early Modern Philosophy","299-327","","1","","Stone, M. W. F.","10.1017/ccol0521822424.012","","The Cambridge Companion To Early Modern Philosophy","isbn:9781139001168","2006"
"10.1080/13674670902911872","","Augustine And Medieval Philosophy","253-266","","1","","Stone, M.W.F.","10.1017/ccol0521650186.018","","The Cambridge Companion To Augustine","isbn:9780521650182; isbn:9780521659857; isbn:9781139000291","2001"
"","8","Non-Greek Doctors Involved In The Nineteenth-Century Revolutions In Crete","117-122","","0","","Ramoutsaki, Ioanna A","10.1177/096777200000800209","2","Journal Of Medical Biography","issn:0967-7720; issn:1758-1087","2000"
